affiliation_id,affiliation_name
2454,"Jaypee Institute of Information Technology, Noida"
2455,"Ph.D Student Of CISIR Department,University Technology Petronas"
2456,"Department of Education, Brain and Motivation Research Institute (bMRI) , Korea University"
2457,"lecturer, University of West Attica"
2458,"Assistant Professor, IU O'Neill School of Public and Environmental Affairs"
2459,"Professor for Pharmaceutics and Biopharmacy, Wurzburg University, Germany"
2460,"Professor of Clinical Genetics, Guy's & St Thomas' NHS Foundatin Trust"
2461,"Department of Mathematics, University of Southern California"
2462,"Postdoc, Rotman Institute of Philosophy"
2463,Universidad de la Costa
2464,"профессор физики, РУДН"
2465,"Assoc. Prof., Ilia State University, Tbilisi, Georgia"
2466,"Profesora, Investigadora, Universidad de Tarapacá"
2467,Professora do curso de Pós graduação em Patologia
2468,"School of Accounting and Finance, Hong Kong Polytechnic University"
2469,St. Jude Children's Reaearch Hospital
2470,USGS Geomagnetism Program
2471,"Senior Lecturer and Scientific Researcher, Department of Chemistry University of Dr Moulay Taher"
2472,Researcher at Teagasc - Irish Agriculture and Food Development Authority
2473,"Department of Psychology, University of Isfahan"
2474,"Professor at the University of Basel, Switzerland"
2475,"Babeș-Bolyai University, Cluj-Napoca, Romania"
2476,"Associate Professor of Accounting, Stevens Institute of Technology"
2477,"Professor, University of Tsukuba"
2478,ADAS
2479,"Emeritus Professor of Biology, Boston University"
2480,Associate Professor in Economics (University of Barcelona)
2481,Novartis
2482,"Professor of Economics, Hiroshima University"
2483,Warwick Business School
2484,"IHP, Innovations for High Performance Microelelectronics"
2485,EPFL
2486,Public Health England
2487,"Retired professor of Computer Science, William Paterson University"
2488,"Assistant Scientist, Woods Hole Oceanographic Institution"
2489,"Universidade do Rio Grande (FURG), Brazil"
2490,"Kiwi team, Loria, France"
2491,Foot and mouth Disease (Sap) Institute
2492,Rzhanov Institute of Semiconductor Physics SB RAS
2493,"Postdoctoral fellow, School of Environmental Sciences, University of Guelph"
2494,New York University
2495,"Director of Research, Krishna Institute of Medical Sciences Deemed University"
2496,"Investigador Titular, Departamento de Botánica, Instituto de Biología, Universidad Nacional Autónoma de México"
2497,"Professor of Psychology and Education, The University of Hong Kong"
2498,"Senior Scientist II, Oncomed Pharmaceuticals Inc."
2499,"VP of Research, Roche Diagnostics"
2500,"System Controls Engineer, Verb Surgical"
2501,"Ph.D. Student, University of Nevada, Reno"
2502,"Professor of Computing Science, Simon Fraser University"
2503,Professor de Filosofia da Educação
2504,Universitat Politècnica de València
2505,Reed College Department of Psychology
2506,"Graduate faculty, University of Georgia"
2507,"Professor, Shanghai Key Lab of Vehicle Aerodynamics, Tongji"
2508,Universität Göttingen
2509,Universidad  Nacional Autonoma de México
2510,"Associate Professor, Zayed University (UAE) | Georg-August-Universität  Göttingen, Germany"
2511,"RESEARCH ASSISTANT PROFESSOR, UNRSOM"
2512,University of Glasgow
2513,"Professor of Physics,  Federal University of Rio de Janeiro (UFRJ)"
2514,University of Illinois at Urbana Champaign
2515,"Professor of Food Engineering, Yüzüncü Yil University"
2516,paris
2517,University of Oslo
2518,University of Connecticut
2519,"Howard University, Washington DC"
2520,"Phd Candidate, IMB Centre for Pain Research, The University of Queensland"
2521,Procter & Gamble
2522,Japan Aerospace Exploration Agency
2523,"Professor of Pharmaceutics, School of Pharmacy, Zanjan University of Medical Sciences, Iran"
2524,"Professor of Management and Organization, The Robert H. Smith School of Business, University of"
2525,Universidad de Buenos Aires
2526,"Research scholar, Department of Physics, Pondicherry University"
2527,INIBIOMA (CONICET - UNCOMA)
2528,"Professore,Universita' di Camerino"
2529,"Research Associate, Nacionalni inštitut za biologijo"
2530,"Postdoctoral Researcher, University of California San Diego"
2531,"Research Assistant , UC Merced"
2532,Universidad Nacional de La Plata
2533,"Ferhat Abbas University Setif 1, Setif, Algeria"
2534,"Hanken School of Economics, Helsinki, Finland"
2535,"Professor of Materials and Technologies, Politecnico di Milano"
2536,"Professor of Real Estate Finance, Massachusetts Institute of Technology"
2537,Université du Québec à Rimouski
2538,"Universidad Isabel I, Burgos, España"
2539,"Northeastern University, Barabasi Lab"
2540,Moores Cancer center - UCSD
2541,Matthew Flinders Distinguished Professor
2542,Bangladesh Atomic Energy Commission
2543,estudiante de contabilidad de la universidad san antoni abad del cusco
2544,"Profesor de Fisiología Vegetal. INFIVE, Facultad de Ciencias Naturales y Museo, Universidad Nacional de La Plata"
2545,PI Industries
2546,Univerzita Palackého v Olomouci
2547,"University of California, Los Angeles (UCLA)"
2548,University of California Los Angeles
2549,"Professor, Embedded Systems"
2550,"School of Medicine and Pharmacology, The University of Western Australia, Perth, Australia"
2551,University of Rochester
2552,"Clinical Institute of Medical Genetics, University Medical Centre Ljubljana"
2553,"Honorary professor, Universities of Geneva and Liege"
2554,isfahan university of medical sciences
2555,"Professor of Mycology, Universidade Federal de Santa Maria"
2556,Fujita Health University
2557,"Professor of Strategic Communication, Arkansas State University"
2558,vision++
2559,US Naval Academy
2560,"Klinika Kardiologii i Chorób Wewnętrznych, Wojskowy Instytut Medyczny"
2561,Universidade Federal de Uberlândia (UFU)
2562,"Professor of Environmental Studies, Nagoya University"
2563,"Artificial Intelligence and Machine Learning group, Universitat Pompeu Fabra"
2564,Inria
2565,Research Fellow MSKCC; Research Assistant Professor SBU (non-tenure track).
2566,mcmaster university
2567,"Head, Centre for Dynamic Imaging, Walter and Eliza Hall Institute"
2568,"Professor, Stanford University, Thomas Jefferson University, Johns Hopkins, Fox Chase Cancer Center"
2569,"Lecturer of Tropical Medincine and Hepato-Gastroenetrology, Faculty Of Medicine, Zagazig University"
2570,"Assistant Professor, Colorado State University"
2571,"Escuela de Bioquímica, Universidad San Sebastián, Santiago, Chile"
2572,University of Huddersfield
2573,The Mina and Everard Goodman Faculty of Life Sciences Bar-Ilan University
2574,"Postdoctoral Researcher, University of Zurich"
2575,"PhD Student, University of Padova, Italy"
2576,"Department of Chemical Engineering, Ming Chi University of Technology (明志科技大學化學工程系)"
2577,"Depto. Ecologia Evolutiva. Museo Nacional de Ciencias Naturales, CSIC"
2578,"Centre for Novel Agricultural Products, Department of Biology, University of York"
2579,universidad juarez autonoma de tabasco
2580,"PostDoc at Space Research Institute, Austrian Academy of Sciences"
2581,"Professor, Physics Institute, National Autonomous University of Mexico"
2582,"Research Associate, Michigan State University"
2583,"Associate Professor, Mechanical Engineering, Federal University of Santa Catarina, Brazil"
2584,DOCTOR
2585,Research Institute for Nuclear Problems of Belarusian State University
2586,ETH Zurich
2587,Scientist at Tata Consultancy Services
2588,Coventry University
2589,"Professor, University of Hawaii Cancer Center"
2590,University of Canterbury
2591,University of Warmia and Mazury in Olsztyn
2592,Central China Normal University
2593,PhD  - PROTEE - Equipe de Biologie Moléculaire Marine - Université de Toulon
2594,lecturer university of liverpool
2595,"Assistant Professor, The University of Oklahoma"
2596,"Professor, Communication Sciences and Disorders, University of Georgia"
2597,"Professor of accounting, grand valley state university"
2598,"Assistant Professor, Govt. General Degree College, Salboni"
2599,ricercatore Università degli Studi di Milano
2600,Director of Contract Services at In Vitro ADMET Laboratories LLC
2601,"Postdoctoral Fellow, Johns Hopkins University"
2602,Université de Lille et Université de Rouen
2603,"Professor in Law and Legal Studies, Carleton University"
2604,University of Shizuoka
2605,"Materials Research Institute, UNAM."
2606,Columbia University Medical Center
2607,"Professor, Memorial University of Newfoundland"
2608,"Scientist, NASA Ames Research Center"
2609,"National Yunlin University of Science and Technology, Yunlin"
2610,"Professor of Antimicrobial Resistance and Antibiosis, Faculty of Health and Animal Sciences, University of Copenhagen"
2611,"Icahn School of Medicine at Mount Sinai, New York"
2612,"Lecturer at the Department of Chemistry, University of Ilorin, Nigeria"
2613,"Professor Engineering Geodesy, TU Wien"
2614,"PostDoc, Dipartimento di Economia, Università di Genova"
2615,Sherwin-Williams
2616,Bogazici University
2617,The Hong Kong Polytechnic University
2618,Staff Scientist @ Hensoldt Optronics GmbH
2619,Shenzhen University
2620,"Research Scientist, Cogent Labs Inc."
2621,IIT Delhi
2622,San Francisco Bay Bird Observatory
2623,"Assistant Professor of Applied Mycology, Weber State University"
2624,Research Scientist at SUNY College of Nanoscale Science and Engineering
2625,Ph.D. Soongsil University
2626,Assistant professor of microbiology
2627,"Computer Science, University of Texas at Austin"
2628,Univesité de Lorraine
2629,Assistant Professor at Middle Tennessee State University
2630,"Professora do Curso de Geografia, Universidade Federal dos Vales do Jequitinhonha e Mucuri"
2631,"Graduate Student, Weill Cornell Graduate School of Medical Sciences"
2632,"Principal HW Engineer, Microsoft"
2633,IRCCS Saverio de Bellis
2634,Research Scientist- Kerry Ingredients and Flavours
2635,University of macau
2636,"Instituto Nacional de Astrofísica, Óptica y Electrónica"
2637,"Professor @ NTU, Singapore"
2638,Universidad de Sevilla / Departamento de Periodismo II
2639,"Assistant Professor, Department of Anthropology, University of California, Santa Barbara"
2640,The Systems Biology Institute
2641,"Professor, INGENIO (CSIC-Universitat Politecnica de Valencia)"
2642,Czech Academy of Sciences
2643,"Research Fellow, Melbourne University"
2644,Associate Professor     -      Electrical and Electronic Engineering
2645,Sloan Kettering Institute
2646,indian statistical institute new delhi
2647,AGH University of Science and Technology
2648,PhD student in Tianjin University
2649,"Alumna de Sociología, Universidad Nacional Autónoma de México"
2650,"Associate Professor of Foreign Languages and Literature, National Sun Yat-Sen University"
2651,UFV
2652,CEA-LETI-DTBS
2653,Politechnika Śląska
2654,"Profesor-Investigador, Universidad Autónoma de Tamaulipas"
2655,Instituto de Matemática e Estatística da Universidade de São Paulo
2656,"School of Marketing, University of New South Wales"
2657,"Student, Radboud Universtiteit Nijmegen"
2658,Massey University
2659,Massachusetts General Hospital - Harvard Medical School
2660,Nagoya Institute of Technology
2661,Clarendon Policy & Strategy Group
2662,"Dept. Architecture, University of Roma Tre"
2663,Sharif University of Technology
2664,"Researcher in Mineralogy, University of Camerino"
2665,"Teaching Assistant, Curtin University"
2666,"Qatar University,Qatar"
2667,NC State University
2668,Professor. Clinical Child Psychology Program. University of Kansas
2669,"Assistant Professor of Structural Engineering, University of Guilan"
2670,Estudiante de Diseño Grafico
2671,Southern California Permanente Medical Group
2672,CNR-IMM
2673,Student
2674,"Assistant Professor in Behavioural Science, London School of Economics and Political Science"
2675,"Alfred Wegener Institute, Helmholtz Center for Polar and Marine Research (AWI)"
2676,"Graduate Student, Colorado State University"
2677,Neurosurgery
2678,"Professor of Animal Breeding, University of Guelph,ABScBG"
2679,UCIBIO FCT NOVA
2680,"Ph.D. Candidate, University of North Carolina at Chapel Hill"
2681,"Senior Researcher, National Research Centre for the Working Environment"
2682,"China University of Mining and Technology, Beijing"
2683,"Professor of Computer Science, Queen's University"
2684,"Department of Pure and Applied Sciences, University of Urbino Carlo Bo"
2685,Associate Professor of Business Information Technology
2686,Hospital Nacional de Niños 'Dr. Carlos Saenz Herrera'
2687,"Beamline Scientist, SOLEIL Synchrotron"
2688,Full professor in Telematics Eng. - Univ. Granada (Spain)
2689,"καθηγητής Σχολής Επιστημών Υγείας, ΑΠΘ"
2690,Pacific Northwest National Laboratory
2691,"CIMeC, University of Trento"
2692,Virginia Commonwealth University
2693,"Founder, Manager and Professor of Halgheh University"
2694,Harvard Medical School and Wellman Center for Photomedicine
2695,"Politecnico di Torino, Italy"
2696,Cardiff University
2697,Rivian Automotive
2698,Faculdade de Ciências Agrárias e Veterinárias/UNESP - Jaboticabal
2699,Professor of Infectious Diseases
2700,princeton university
2701,"AUSGAR Technologies, Inc."
2702,PhD University of Arid Agriculture Rawalpindi Pakistan
2703,"Reader in Film and Television Studies, University of Birmingham"
2704,Lancaster University
2705,Hospital das Clínicas da Faculdade de Medicina da USP (HC-FMUSP)
2706,"Department of Geography, The Ohio State University"
2707,"Professor de Fisiologia Humana, Universidade de São Paulo"
2708,"SSPT-MET-CLIM,ENEA, Rome,Italy"
2709,Korea university
2710,"Professor of Geographic Information Science, Keio University"
2711,Oregon Health and Science University
2712,Kenyatta University
2713,"Associate Professor, Information Studies, University of Maryland College Park"
2714,Georgia State University
2715,"Catedrático de Botánica, Universidad de Almería"
2716,University of Derby
2717,"Professor Abdulazeez University; Jedeha, Saudi Arabia;Thomson Highly Cited Researcher"
2718," Professor of Medicine, University of North Carolina"
2719,Amazon
2720,"Profesora titular, Universidad de Guayaquil"
2721,"Dept. of Aerospace Sciences, Univ. Politehnica of Bucharest"
2722,Oklahoma State University
2723,Annamalai University
2724,"Post Doctoral Research Associate at UT-ORNL Joint Institute of Biological Sciences, Centre for"
2725,The University of British Columbia
2726,DE Shaw & Co.
2727,"Postdoctorate Research Fellow, University of Lincoln, UK"
2728,"Professor of Environmental Engineering, Temple University"
2729,Plant Genomic and Breeding Center
2730,Technische Universität Chemnitz
2731,National Renewable Energy Laboratory (NREL)
2732,UT Southwestern Medical Center
2733,"Toyota Central R&D Labs., Inc."
2734,"Professor of Computer Enginnering,Nirma University"
2735,Tianjin University
2736,Universidade Federal do Espírito Santo
2737,University of Chile
2738,"Sister Nivedita University, techno India Group"
2739,Hostos Community College CUNY
2740,"Faculty of Human Sciences, Shimane University"
2741,Doutor
2742,Assoc. Prof. Dr.
2743,"Broad Institute, Dana-Farber Cancer Institute"
2744,"Northern Technical University, Technical College/ Kirkuk"
2745,Department of Natural Resources & Cornell Lab of Ornithology - Cornell University
2746,PAAET:  Public Authority for Applied Education and Training
2747,"Lecturer, University of Kent"
2748,"Faculty of Education, The University of Hong Kong"
2749,Antibiotic Resistance Action Center @ George Washington University
2750,"Associate Professor of Political Science, Georgia Southern University"
2751,Queensland Alliance for Agriculture and Food Innovation - The University of Queensland
2752,Queen's University
2753,"Postdoctoral Fellow, Georgia Institute of Technology"
2754,Advanced Micro Devices Inc
2755,"Professor of Business Administration, Tarbiat Modares University"
2756,"Pathologist, Krishna Institute of Medical Sciences, Karad"
2757,Kavli Insitute for Systems Neuroscience and Center for Neural Computation (NTNU - Trondheim)
2758,"Lecturer in journalism and new media, Erasmus University Rotterdam & Hague University of Applied Sciences"
2759,Fraunhofer MEVIS
2760,United Nations Development Programme
2761,"Lecturer in Intelligence and International Security, King's College London"
2762,Profesor de Filosofía - Bachillerato
2763,"Professor, Universiti Putra Malaysia"
2764,"Postdoc fellow, the Chinese University of Hong Kong"
2765,Princess Margaret Cancer Centre/Mount Sinai Hospital
2766,Okayama University
2767,"Postdoctoral fellow, Immunology, MD Anderson Cancer Center"
2768,Professor of Fluid Dynamics and Heat and Mass Transfer
2769,Instructor
2770,"Professor of Physics, University of Texas at Austin"
2771,"University of Valladolid (Spain), ISEND SA, University Isabel I (Spain)"
2772,"TU Berlin, Polymer engineering and Physics"
2773,Investigador del CONICET. Instituto de Investigaciones Farmacológicas. UBA-CONICET.
2774,"Cloud Microphysics Group Leader , Institute of Meteorology and Climate Research, Karlruhe Institute"
2775,"S. Scientist, DDI"
2776,"Oxford Big Data Institute, University of Oxford"
2777,"Chemical Engineering Department, University of Santo Tomas"
2778,Charles University in Prague
2779,Mechanical Engineer Researcher
2780,"INESC-ID, Instituto Superior Técnico, Universidade de Lisboa"
2781,Profesora Titular de Química Inorgánica. Universidad de Castilla - La Mancha
2782,"Associate Professor, Department of Biostatistics, Yale University"
2783,Profesor de la Universidad de Santiago
2784,"University of Florence, Italy"
2785,"Finnish Museum of Natural History; & Dept. Geosciences and Geography, University of Helsinki"
2786,"Assistant lecturer of Public Health, Ain Shams University"
2787,"Professore di Neurologia, Università di Pavia"
2788,"Professor of Biological Sciences, UNIST"
2789,professor university of southern california
2790,Maitre de Conférence A (MCA)
2791,Power Module Technologist @ Texas Instruments
2792,Researcher at Fondazione Bruno Kessler
2793,"Professor of Architectural Engineering, Kyung Hee University"
2794,"Research Associate, University of Saskatchewan"
2795,Universität Augsburg
2796,Forschungszentrum Jülich GmbH
2797,Guilin University of Technology
2798,"Hale School, Western Australia"
2799,Orta Doğu Teknik Üniversitesi / Middle East Technical University
2800,"Endocrinologist, St Vincent's Hospital, Melbourne"
2801,"Professor in Signal Processing, Chalmers University of Technology"
2802,The University of Tennessee
2803,"University of Texas, Austin"
2804,"1) Swami Keshvanand Institute of Technology, Management & Gramothan, Jaipur;   2) MNIT Jaipur"
2805,Queensland University of Technology
2806,"Department of Natural Sciences and Environmental Health, University of South-Eastern Norway"
2807,"Assistant Professor, University of Minnesota"
2808,Independent consultant
2809,"Teaching Assistant, Faculty of Electronic Engineering, Menoufia University"
2810,Kastamonu Üniversitesi
2811,"Senior Researcher, Tenaris Process R&D"
2812,"Assistant Research Professor, Sleep and Performance Research Center, Washington State University"
2813,"Assistant Professor of Petroleum Engineering, Missouri S&T"
2814,Tenured Senior Researcher in Macrophyte Ecology (CSIC)
2815,"Associate Professor, Imperial College London"
2816,"Departamento de Sistemas Elétricos de Automação e Energia, UFRGS"
2817,Associate Research Fellow
2818,Paul Scherrer Institut
2819,Manchester Metropolitan University
2820,IIT Kanpur
2821,Orthopedic Surgery
2822,"Tunghai University, Taiwan"
2823,"Universidad de Alcalá de Henares, Centro Universitario Cardenal Cisneros"
2824,Kühne Logistics University
2825,"Researcher, Robert Bosch GmbH"
2826,"Graduate Center, City University of New York"
2827,"Director, California Ethnic and Multicultural Archives, Library, University of California Santa Barbara"
2828,"Assistant Professor of Crop Breeding, Agronomy Department, Faculty of Agriculture, Al-Azhar University"
2829,"Professora de Biologia Celular, Universidade Estadual de Londrina"
2830,Johns Hopkins
2831,"Professor, Ohio State University"
2832,Research Associate in the Center for Advanced Solid and Liquid based Electronics and Optics (CASLEO)
2833,Department of Economics and Management - University of Ferrara
2834,hoover institution
2835,"Assistant Professor of Management and Entrepreneurship, University of North Georgia"
2836,MIP EA4334
2837,"Dept of Aerospace Engineering, Universiti Putra Malaysia"
2838,Victoria University of Wellington
2839,Notre Dame University-Louaize
2840,"General Surgery Resident, PhD Student, 'Iuliu Hatieganu' University of Medicine and Pharmacy, Cluj"
2841,H. Lee Moffitt Cancer Center
2842,"Professor of Biomedical Engineering, Diagnostic Radiology & Electrical Engineering, Yale University"
2843,"Assistant Lecturer, Agricultural Engineering, Faculty of Agriculture, Benha University, Egypt"
2844,"Staff scientist, Weizmann Institute of Science"
2845,"Professor of Chemical Engineering, TMU, Tehran, Iran."
2846,"Department of Botany, University of Delhi"
2847,"University of Goettingen, Institute of Ecology and Evolution RAS"
2848,"Scientist, Space Applications Centre (ISRO)"
2849,Cyprus Ministry of Education and Culture
2850,"PhD Candidate, Theory of Condensed Matter, University of Cambridge"
2851,"Professor of Computer Science, Graz University of Technology"
2852,Bialystok University of Technology
2853,PhD from American University
2854,"Dr.-Ing., Forschungszentrum Jülich"
2855,Walter P. Murphy Professor of Mechanical Engineering
2856,Hefei University of Technology
2857,REQUIMTE/LAQV-GRAQ- Polytechnic Institute of Porto
2858,"Pos Doc, IST"
2859,Université de Sherbrooke
2860,"Professor of Polymer Chemistry and Biomaterials, University of Twente"
2861,"2nd Affiliated Hospital , Zhejiang University"
2862,"Medical student , Universidad Nacional San Antonio Abad de Cusco"
2863,Universidad de Navarra
2864,"Senior Lecturer,  Mzumbe University"
2865,"Southeast University(SEU, 东南大学)"
2866,"Senior Research Fellow, Dept. of Biosciences and Bioengineering, Indian Institute of Technology Guwahati"
2867,"Assistant Project Scientist, University of California San Diego"
2868,"Professor, Computer Science, William & Mary"
2869,National Taichung University of Science and Technology
2870,"Professor of Physics, Illinois Institute of Technology"
2871,Ohio University
2872,Sheffield Hallam University
2873,Nanjing University
2874,Sun Yat-sen University （中山大学水资源与环境系）
2875,University of Wisconsin
2876,"Head of Multiscale Materials Modelling Group, Paul Scherrer Institut (PSI)"
2877,INSTITUTO NACIONAL DE PEDIATRIA
2878,"Postdoctoral Fellow, University of California, Berkeley"
2879,German Federal Institute for Risk Assessment
2880,"PhD Candidate, Nanyang Technological University"
2881,University of Missouri
2882,"PhD, University of Sydney"
2883,"Institute of Metal Research, CAS"
2884,"Dean (Learning & Teaching), Griffith Sciences, Griffith University"
2885,Ministerio de Cultura (Perú)
2886,Karadeniz Teknik Üniversitesi
2887,"Electrical Engineering Department, University of Basrah"
2888,Dow Chemicals
2889,"Professor - Duke-NUS Medical School, Senior Consultant Obstetrician and"
2890,North Caroliina Museum of Natural Sciences
2891,"Assistant Professor, Osmaniye Korkut Ata University"
2892,"dr.,  Forest Research and Management Institute"
2893,University of California Santa Barbara
2894,EFS Consultants
2895,"KNO arts - otoloog, Erasmus MC"
2896,"CiNet, National Institute of Information and Communications Technology"
2897,Pontifical Catholic University of Rio Grande do Sul - PUCRS - BRAZIL
2898,Vanderbilt University
2899,"ESAMC - Escola Superior de Administração, Marketing e Comunicação"
2900,JNCC; Bournemouth University; Queen's University Belfast
2901,Google Zürich
2902,"Professor of Medicine, Harvard Medical School, Brigham and Womens Hosp, Harvard Sch of Public Health"
2903,"Continuing Lecturer, University of California, Davis"
2904,"Associate Professor of Computer Engineering and Computer Science, University of Louisville"
2905,"Staff Scientiest, Jefferson Lab"
2906,"Stella Maris Foundation, Smile Lab"
2907,University of Diyala - College of Medicine - Department of Biochemistry
2908,Chalmers University of Technology
2909,Military Institute of Engineering - IME
2910,Head of Bioinformatics Unit at Institute of Parasitology and Biomedicine 'Lopez-Neyra'
2911,Mcdermott Will & Emory
2912,"Clinician scientist , Leipzig University Hospital - Department of endocrinology and Nephrology"
2913,shahid bahonar university of kerman
2914,"Assistant Professor, Hang Seng Management College"
2915,"Assistant Professor, Kyung Hee University"
2916,"Assistant Professor, New York University"
2917,Helmholtz Centre for Infection Research
2918,Gyeongsang National University
2919,"Professor of Microbial Genetics, University of Bucharest"
2920,Ankara University
2921,"Norwegian University of Life Sciences, Dep of Chemistry, Biotechnology and Food Science"
2922,Istituto Zooprofilattico Sperimentale delle Venezie
2923,National Institute of Advanced Industrial Science and Technology (AIST)
2924,"Professor of Editorship & Agricultural Engineering, Chinese Academy of Agricultural Engineering"
2925,Trinity College Dublin
2926,Middle East TEchnical University
2927,"Institute of Physics National Academy of Science , Harran University, Turkey"
2928,"Professor of Psychology, University of Oviedo"
2929,"Research Fellow, Memorial Sloan Kettering"
2930,PhD student at Applied Magnetism Institute (IMA)
2931,A.C.Camargo Cancer Center
2932,"Ph.D Research Scholar, Panjab University, Chandigarh"
2933,Hindustan Institute of Technology and Science
2934,"Columbia University, Fellow, Committee on Social Thought"
2935,"CENTRO DE INVESTIGACIONES ENERGETICAS, MEDIOAMBIENTALES Y TECNOLOGICAS"
