affiliation_id,affiliation_name
1,Post-doc at School of Public Health - University of Sao Paulo
2,"Research Staff, Lawrence Livermore National Laboratory"
3,University of Pennsylvania
4,University of Hartford
5,"Debreceni Egyetem, Neurológiai Tanszék"
6,Istituto Italiano di Tecnologia
7,Professor Adjunto Universidade Federal de Ouro Preto
8,"York MRI Facility, Centre for Vision Research, York University"
9,"CNRS Researcher, UMR 6521, University of Brest, France"
10,University of Texas at Rio Grande Valley-School of Medicine
11,Unknown affiliation
12,Michigan State University
13,iran university of medical sciences
14,"Assoc. prof., CAVE lab dir., grad. prog. dir. (BME), Dept. of Engineering, Aarhus University"
15,"Associate Professor, Department of Economics and Statistics University of Naples Federico II"
16,Technical University of Sofia
17,University of Copenhagen
18,"Associate Professor, lektor, Aalborg University"
19,"Escola de Química e Alimentos, Universidade Federal do Rio Grande - FURG"
20,Australian national university
21,Berlin University of Technology em.
22,"Professor, Spatial Hearing Laboratory, Chiba Institute of Technology, Japan"
23,NDVSU
24,"University of California, San Diego"
25,"School of Mathematical Sciences, University College Dublin"
26,University of Chicago
27,Charles Sturt University
28,"PhD student, University of Helsinki"
29,National Chiao Tung University
30,"Department of Physics, National University of Singapore"
31,BMT Program Director. National Center for Cancer Care and Research. Hamad Medical Corporation. Doha
32,"Researcher, Tokyo University of Agriculture and Technology"
33,Professor in Cognitive Development
34,Universidad de Guayaquil
35,Postdoc at Joint Genome Institute
36,NSRI (Nippon Steel & Sumikin Research Institute Corporation)
37,University of Maragheh
38,"Department of Pharmacology, Faculty of Medicine, Tanta University, Egypt"
39,"Ialamic Azad university, Lenjan Branch, Esfahan, Iran"
40,Perugia University
41,"School of Interdiciplinary Mathematical Science, Meiji University"
42,Zonguldak Bulent Ecevit Universitesi
43,"University of Freiburg, Germany and Concept Engineering GmbH, Freiburg, Germany"
44,"Professor of Mathematics, University of Wollongong, Australia"
45,chung nam national university
46,National Defense Academy of Japan
47,"Medical Institute of Bioregulation, Kyushu University"
48,"Lecturer in Psychology,  Nottingham Trent University"
49,"Professor, School of Chemical Engineering, The University of Adelaide, Australia"
50,McGill University
51,"Proffessor, Physics Department, NTUA"
52,"Professor, Ryerson University"
53,Universidad de Guadalajara
54,"Assistant Professor of Business Administration, Technical University of Madrid"
55,Postdoc - Laboraroty of Medicine and Pathobiology - University of Toronto
56,Dong-A University
57,Royal Canin
58,Language Learning Books Author
59,University of Graz
60,University of Nevada at Las Vegas
61,"Tongji University, Shanxi Transportation Research Institute"
62,"Scientist, Los Alamos National Laboratory"
63,Tatung University
64,Aalborg University
65,university of Wisconsin Madison
66,"Institute of Biomedical Sciences, Academia Sinica"
67,ד״ר
68,Instituto Tecnológico de Costa Rica
69,Kean University
70,UC San Diego/Rady Children's Hospitals
71,Professor of public health and community medicine
72,Granada University
73,"GeoBioTec, RISCO / University of Aveiro"
74,German University in Cairo
75,"Associate Professor of Computer Science, Tel-Hai College"
76,"Radboud University, Donders Institute for Brain, Cognition and Behaviour"
77,"Research Scientist, Agriculture and Agri-Fodd Canada"
78,Professor i Neurologi
79,"professor of biochemistry, University of Milan"
80,"Assistant Professor, Department of Farm Forestry, Sant Gahira Guru Vishwavidyalaya, Sarguja"
81,Universität Bremen
82,"Professor of Astronomy, University of Cambridge"
83,Oakwood University
84,The University of Tokyo
85,"Hospital Pablo Tobón Uribe, Universidad Pontificia Bolivariana"
86,"Professor of Law, La Trobe University"
87,"AI Research Manager, Avast"
88,Aon
89,Xi'an Modern Chemistry Research Institute
90,Museo Maritímo del Cantábrico
91,"Research Fellow, University of Surrey"
92,"Leading researcher, Institute of Mechanics, Moscow State University"
93,"Assist. Professor of pediatric Nursing, Qassim University"
94,"Ecologist, Landcare Research, New Zealand"
95,"Investigadora, CONICET"
96,Pesquisadora do Instituto de Pesquisas Tecnológicas
97,Assistant Professor at UAEU
98,Beth Israel Deaconess MEdical Center
99,"PhD student, ETH Zurich"
100,National Cheng Kung University
101,Professor of Management and Sociology; University of Michigan
102,Curtin University
103,"Associate Professor, Department of Studies in Mathematics, Vijayanagara Sri Krishnadevaraya"
104,South Ural State University (Южно-Уральский государственный университет)
105,"Instituto de Matemática e Estatística, Universidade de São Paulo"
106,"Professor of Material Science, Shanghai University"
107,"Professor of Computer Science, Leiden University & University of British Columbia"
108,Brigham and Women Hospital
109,London School of Economics and Political Science
110,"Institute of Petrochemical Synthesis, Russian Academy of Sciences, Moscow"
111,"Professor, Center for Language Engineering, KICS-UET"
112,Christopher Newport University
113,"Project Researcher, D.Sc. (Tech), Åbo Akademi University, Laboratory of Thermal and Flow Engineering"
114,"Pharmacologie, APHM"
115,Department of Computer Information and Network Engineering Lunghwa University of Science and
116,Chung Yuan
117,PhD Student
118,Shahid Beheshti University of Medical Sciences
119,Professor Adjunto (UFSCar  -  Departamento de Física)
120,"Professor de Química, Universidade Federal dos Vales do Jequitinhonha e Mucuri"
121,University of Illinois at Chicago
122,Istituto Nazionale di Geofisica e Vulcanologia
123,University of the Basque Country - UPV/EHU
124,Johnson & Johnson
125,"National Institute for Materials Science (NIMS), Tsukuba, Japan"
126,"Assistant Lecturer, Commerce College, University of Sulaimani, Kurdistan Region"
127,Boston University
128,"University of Nevada, Reno"
129,andhra university
130,"Assistant Professorial Research Fellow, London School of Economics"
131,Profesor Investigador Universidad Autónoma de Nuevo León
132,"Psychology, Indiana University South Bend"
133,IJRM Team Tel: +98 351 824 7085-6 Fax: +98 351 824 8348 Research and Clinical Center for Infertility
134,Democritus University of Thrace
135,PhD Candidate Dalhousie University
136,"Professora de Bioestatística, Universidade Estadual do Oeste do Paraná"
137,"Hunter College, CUNY"
138,"Graduate Research Assistant, University of Maryland, College Park"
139,University of Minnesota
140,"Chemistry, School of Natural and Computational Sciences, Massey University, Albany, NZ"
141,Universidade Federal de Santa Catarina
142,"Assistant professor, Jazan University"
143,"Senior Lecturer, University of Sheffield"
144,"Assistant Professor, Emory University"
145,Servei d´Immunologia. Hospital del Mar
146,"Associate Professor, Division of Packaging Technology, Faculty of Agro-Industry, Chiang Mai"
147,Politecnico di Milano
148,"Paleontology Collections Manager, Cincinnati Museum Center"
149,Institute of Cancer Research
150,"Professor of Biology, University of Nevada Reno"
151,Ph.D. Candidate in the Chemistry Department at Rice University
152,"Head of Clinical Biochemistry and Pharmacology Laboratory, Ente Ospedaliero Cantonale"
153,"Research Fellow in Metrology, University of Nottingham"
154,University of Illinois Urbana-Champaign
155,Director of Intecso
156,UNIVERSIDAD MICHOACANA DE SAN NICOLAS DE HIDALGO
157,"Postdoctoral Fellow, Northwestern University"
158,"Post-Doc - Assistance Publique Hôpitaux de Paris, Institut Cochin - Bâtiment Roussy Inserm U1016 - Cnrs UMR8104 - Université Paris Descartes"
159,"Director, Helmholtz-Institute Erlangen-Nürnberg for Renewable Energy (IEK-11), FZ Jülich"
160,National University of Defense Technology
161,Lulea University of Technology
162,Jilin University
163,"Centre for Polymer and Material Technologies, Ghent University"
164,Integrate Researcher at CIC.DIGITAL - Universidade do Porto
165,"Faculty of Physics, University of Tabriz, Tabriz, Iran"
166,"Specially Appointed Assistant Professor at Division of Global Epidemiology, Hokkaido University"
167,Estudiante de Ingeniería Ambiental Universidad Ecci
168,"Research Scholar, JAIN (deemed-to-be University)"
169,Montana State University
170,Université de Liège
171,"Associate Professor of International Economics, ISS (Erasmus University Rotterdam)"
172,Fraunhofer Institute for Nondestructive Testing
173,"Assistant Professor-Crop Physiology, Montana State University"
174,"Graduate Student, University of Rochester"
175,University of Manchester
176,University of Neuchatel
177,University of Colorado Boulder
178,Seton Hall Law
179,UNIVPM
180,"Brown Forman Chair in Entrepreneurship, University of Louisville"
181,Universidade Federal da Bahia
182,Carnegie Mellon University
183,University of Exeter Medical School
184,University of Cincinnati
185,"Center for Nanophase Materials Sciences, Oak Ridge National Lab"
186,Engineer Research and Development Center
187,University of Iowa
188,Universidad EAFIT
189,"Professor of Food Microbiology, University of Illinoise at Urbana-Champaign"
190,Professore di Biochimica Università di Pisa
191,University of Nottingham
192,"Zamfara state college of education Maru-Zamfara state, Nigeria"
193,"Associate Professor, Johns Hopkins University"
194,"Liew Family Professor of Molecular Engineering, Professor of Chemistry,University of Chicago"
195,"PhD, Institute of Biomedicine of Seville (IBiS)-HUVR/University of Seville/CSIC, Spain."
196,RWTH Aachen University
197,"Materials Science Engineer, American Testing Services"
198,UNICAMP
199,"Professor of Civil and Architectural Engineering, Qatar University"
200,"Гомельский государственный медицинский университет, Gomel State Medical University"
201,Dr. Wood Science and Biomass Energy
202,"Associate Professor of Mechanical Engineering, Washington State University"
203,"Professor of Biology, Colby College"
204,"PhD, MD"
205,Professor
206,"Kelley School of Business, Indiana University"
207,"Lecturer in Zoology, School of Biological, Earth and Environmental Sciences, UCC"
208,Universidad Tecnica Federico Santa Maria
209,Texas Woman's University
210,Northwestern University
211,Université de Québec à Montréal
212,"Mechanical and Aerospace Engineering, George Washington University"
213,"G. S. Sanyal School of telecommunications, IIT Kharagpur, and Graphic Era University Dehradun"
214,"Software Developer, Ajman University, Ajman, United Arab Emirates"
215,Hoseo University
216,"Dr. in Physics, Biostatistician Roche Diagnostics"
217,"Research Scientist, Agroscope"
218,Northeastern University
219,Loma Linda University
220,"Instituto de Ciências Biomédicas, Universidade Federal do Rio de Janeiro"
221,Incyte Corp
222,"egyetemi docens, Budapesti Műszaki és Gazdaságtudományi Egyetem"
223,CNRS
224,Univ.-Ass. Mag. Dr.rer.nat
225,Universidad Autónoma de Madrid
226,"United Nations, Population Division"
227,Instytut Badawczy Leśnictwa
228,Durham University
229,The Pennsylvania State University
230,"Assistant Professor, Al-Baha University"
231,Universidade Federal de Viçosa
232,icahn school of MEDICINE at mount sinai
233,Nanjing University of Posts and Telecommunications
234,October University for Modern Sciences and Arts (MSA)
235,"Universidad del Rosario, Escuela de Ciencias Humanas, GI Estética y Política"
236,imperial college
237,University of Greenwich / Hughes Associates / University of Maryland
238,"Scientist, Teneobio, Inc."
239,"Postdoctoral Research Fellow, Massachusetts General Hospital"
240,"University of Kassel, University of Ghana"
241,"Associate Professor of Neurology and Neuro-Oncology, Stanford University"
242,Covance Inc.
243,"Associate Professor, IIT Gandhinagar"
244,"Department of Physics, University of Fribourg"
245,"Alpha Analyst, Kena Labs"
246,"Professor of Geriatric Medicine, University  of Hawaii"
247,Professor of Clinical Pathology (Laboratory Medicine)
248,Incheon National University
249,Universidade de Santiago de Compostela
250,"Professor of Computer Science, University of Caen Normandy"
251,"Assistant Dean (Student Affairs), Faculty of Engineering, The Chinese University of Hong Kong"
252,CORESEARCH - Center for Outcomes Research and Clinical Epidemiology
253,Faculdade de Psicologia Universidade de Lisboa
254,Professor of Immunology. Universidad de Murcia. Spain
255,"School of Environmental Sciences, Jawaharlal Nehru University, New Delhi, INDIA"
256,"Associate Professor in Plant Physiology, Department of Ecology, Environment and Plant Science"
257,Ben-Gurion University of the Negev
258,"Institute of Automation, Chinese Academy of Sciences"
259,"Associate Professor of Mechanical Engineering, College of Aburaihan, University of Tehran"
260,"Postdoctoral Scholar, University of California at Irvine"
261,Facebook Inc.
262,The Connecticut Agricultural Experiment Station
263,Louisiana State University
264,"Institute of Integrated Biotechnology, Sogang University"
265,"Postdoctoral Research Fellow, Drexel University"
266,Waseda University
267,"Postdoctoral Research Associate, Boston University School of Medicine"
268,"Visiting Research Scientist, Department of Medicinal Chemistry, University of Michigan"
269,The University of Sydney
270,"Centre For Nanoscience and Nanotechnology, Jamia Millia Islamia"
271,MeasureMeNow
272,"Q-carbon LLC, North Carolina State University"
273,Maine Shellfish R+D
274,"Partner Institute for Computational Biology, Chinese Academy of Sciences"
275,"Associate Professor of Meteorology and Physical Oceanography, University of Miami"
276,Flemish Institute for Technological Research & Hasselt University
277,American Red Cross
278,Sony Corporation
279,Geophysical Institute of Peru
280,Profesora de Antropología Física
281,The George Institute for Global Health
282,"Post-doctoral researcher, LIP6 (Paris 6)"
283,"Ph.D., Maastricht University, Department of Data Science and Knowledge Engineering"
284,"Department of Biotechnology, Kulliyyah of Science, International Islamic University Malaysia"
285,"Researcher, Eel River CZO, University of California, Berkeley"
286,IESL FORTH
287,Washington State University
288,"Professor of Anthropology, University of Dhaka"
289,"Assistant Professor of Media Arts and Sciences, MIT"
290,"Professor, Department of Sociology and the Institute for Society and Genetics, UCLA"
291,"Professor of Social Psychology, HOD Psychological & Behavioural Science, LSE"
292,Nagoya University
293,Akdeniz University
294,"Professor and Chair of Management Information Systems, ETH Zurich"
295,"LESIA, Observatoire de Paris"
296,"UVO, PGD, NICHD, NIH (Charles River)"
297,"Research Plant Pathologist, USDA Forest Service"
298,Institute for Fiscal Studies
299,Museum of Western Colorado
300,"Research Assistant, Trinity College Dublin"
301,"Department of Psychology, Universite du Quebec a Montreal, Canada"
302,You can reach me at 646-312-4168 or through email: feng.chen@baruch.cuny.edu.
303,"Assistant Professor, Department of Cellular & Physiological Sciences, Life Sciences Institute"
304,"Graduate Student, University of California at Santa Cruz"
305,"professor of computer science, Beijing Jiaotong University"
306,Marshall University Joan C. Edwards School of Medicine
307,Institute of National Economy
308,The University of Toronto
309,Children's Cancer Institute
310,"Director, Elsevier Labs"
311,Koç University
312,aga khan university
313,Glasgow University
314,Prof. Dr. Department of Biochemistry and Tissue Biology Institute of Biology UNICAMP
315,"School of Health Sciences, University of Tampere"
316,Swinburne University of Technology
317,Universidade de São Paulo
318,"Professor of Information Systems, Singapore Management University"
319,"Department of Polymer Chemistry, Kyoto University, Japan"
320,"Professor Titular Enfermagem, Nutrição e Fisioterpia"
321,"PhD Scholar, Monash University"
322,"Fellow in the Government Department, London School of Economics"
323,"Académico Docente, Universidad Autónoma de Chile"
324,"Professor, Kyoto University"
325,Victoria University
326,Southeast University
327,Contamac Ltd
328,"Researcher, CRIM"
329,Knowledge exchange and Impact Project Manager
330,TU Graz
331,Instytut Odlewnictwa
332,"Staff Scientist, Diamond Light Source, Harwell@Oxford"
333,"Glenn L. Martin Institute Professor, University of Maryland"
334,"Professor of Obstetrics and Maternal Fetal Medicine, University College London"
335,"Assistant Professor, Institute for Management Research, Radboud University"
336,Yale
337,University of Houston
338,IST Austria
339,"Professor, Centro de Investigación en Matemáticas"
340,Johns Hopkins University
341,"Assistant professor, Insitute of Public Health, National Yang-Ming University"
342,"Professore di sistemi elettrici per l'energia, Dipartimento Ingegneria Industriale, Università di Padova"
343,University of Michigan
344,"Center for Food Safety, University of Georgia"
345,The Ohio State University
346,"Ph.D of Analytical chemistry, Tuba, School of Traditional Medicine; Tehran University"
347,"Chief Scientist and Battelle Fellow, Biological Sciences Division, PNNL"
348,"Science For Life Laboratories, Karolinska Institutet"
349,UCSD
350,Oregon State University
351,"Assistant Professor of Sociology, Florida Atlantic University"
352,"Mestrando em Biodiversidade, Ambiente e Saúde - UEMA"
353,"Natural Resources Institute, University of Greenwich"
354,"Centro de Investigación Científica y de Educación Superior de Ensenada, B.C."
355,"Mestrando em Inteligência Artificial, Universidade de São Paulo"
356,Università di Cagliari
357,University of Nebraska-Lincoln
358,Universidade Federal de Santa Maria
359,Douglas Mental Health University Institute
360,Universidad Tecnológica de Pereira
361,The Queen Elizabeth Hospital
362,"Kazan Federal University, Institute of Philology and Intercultural Communication"
363,Indiana University
364,"Professor da Engenharia de Materiais, Universidade Federal do ABC, Santo André - SP - Brasil"
365,Brazilian Federal Police
366,Dankook University
367,Kent State University
368,"Mohamed Seddik Ben Yahia University, Jijel"
369,Bishop's University
370,Global Climate Forum
371,"Professor of Sedimentology, Chonnam National University"
372,Directeur de recherche CEA LIST
373,University of Utah
374,"Universiti Teknologi Malaysia - IBB University, Yemen"
375,"University-Hospital Schleswig-Holstein, Campus Kiel"
376,"PhD researcher, Cultural Geography, Faculty of Spatial Sciences, University of Groningen"
377,Estudante de Doutoramento; Universidade Nova de Lisboa
378,Professor of Operations and Supply
379,"Lecturer, Centre for Exercise and Sports Medicine"
380,Universidad de Chile
381,"Xi'an Jiaotong University; University of Michigan, Ann Arbor"
382,Nanyang Technological University
383,Concordia University
384,University of Antwerp
385,Columbia University
386,"Department of environmental health engineering, shahid beheshti univercity of medical science"
387,"Professor of Computer Science and Engineering, Shanghai Jiao Tong University"
388,National Institute of Standards and Technology
389,university of manchester
390,U.S. Geological Survey
391,Kyung Hee University
392,SINTEF Building and Infrastructure
393,The University of Hong Kong
394,"Professor of Philosophy, Hobart and William Smith Colleges"
395,"Professor für Differentielle Psychologie, Persönlichkeitspsychologie und Psychologische Diagnostik, Universität Bielefeld"
396,Osaka University
397,"Associate Professor, School of Biology and the Petit Institute for Bioengineering and Bioscience, Georgia Institute of Technolog"
398,Tabriz University
399,"Associate professor, University of Gothenburg"
400,"Full Professor, University of Costa Rica (retired)"
401,"Professor of Physics, Shanghai Jiao Tong University and Tsung-Dao Lee Institute"
402,"Dept Environ. Physics and Irrigation, Inst. of Soil, Water and Environ. Sci., ARO, Israel"
403,National Taiwan University
404,"Lomonosov Moscow State University, Faculty of Physics"
405,Google
406,"Assistant Professor University of Siena - Department of Environment, Earth and Physical Sciences and"
407,"Professor of Mathematics, Carleton University and University Lille 1"
408,Shandong University
409,"College of Veterinary Medicine, university of sulaimani"
410,H. W. Wilson Company
411,ETRI
412,"PhD candidate, Stockholm Resilience Centre, Stockholm University"
413,"Research Scientist, Google Brain"
414,"Director del Instituto del Hospital del Mar de Investigaciones (IMIM), Profesor de Toxicología Asociado a la UPF"
415,German Aerospace Center (DLR)
416,"Principal Security Researcher, GDATA Advanced Analytics"
417,University of Macedonia
418,Instituto Nacional de Ciencias Médicas y Nutrición Salvador Zubirán
419,"Full Professor of Philosophy of Nature and Science, Pontifical Lateran University, Rome"
420,Amirkabir University of Technology
421,University of Washington
422,Gdansk University of Technology
423,"Jinan University, Beijing University of Posts and Telecommunications, Columbia University"
424,"Associate Professor, School of Labor and Employment Relations, University of Illinois at Urbana"
425,"Luck Professor & Associate Dean, Auburn University"
426,"Professor of Theoretical Physics, Swinburne University of Technology"
427,University of Macau
428,"professor of computer science, university of Rennes1"
429,"Wuhan University of Technology, China"
430,"Department of Industrial and Manufacturing Engineering, University of Engineering &Technology"
431,HaiNan University
432,"Honorary Professor of Theoretical Physics, University of Salerno, Salerno, Italy"
433,Tokyo Denki University
434,"Research Assistant, Quality and Usability Labs, TU Berlin"
435,Professor of Environmental Plant  Physiology
436,"Post-doctoral fellow, Duke University"
437,Associate Professor - EA 7519 - PETALES group - Transformations & Agro-Ressources - UniLaSalle
438,Universidade Federal de Minas Gerais
439,Chonbuk National University
440,"PhD Student, Stanford University"
441,"National Brain Research Centre, Manesar"
442,Washington University in St. Louis
443,"Professor of Biostatistics, Indiana University, Indianapolis"
444,"Institute of Physics and SMCEBI, University of Silesia"
445,"National Agriculture and Food Research Organization   Institute of Crop Science, NARO"
446,"Assistant Professor, University of Alabama at Birmingham"
447,Iowa State University
448,University of North Carolina at Chapel Hill
449,Weizmann Institute
450,Comenius University
451,Centre d'Estudis Demogràfics / Autonomous University of Barcelona
452,"PhD Candidate, University of Patras, Greece"
453,Max-Planck-Institut für Biochemie
454,"Professor of Corrosion Science and Engineering, University of Manchester"
455,"Leading researcher, Laboratory Head"
456,"Dipartimento di Scienze Chimiche, Universita' degli Studi di Napoli Federico II"
457,"Richard Seagrave Associate Professor of Chemical and Biological Engineering, Iowa State University"
458,"IEMN Cnrs (Inst. of Electronics, Microelectronics and Nanotechnology) University of Lille I, France"
459,Ghent University
460,Universitat Autònoma de Barcelona
461,"Masarykova univerzita, Fakulta sociálních studií, Pedagogická fakulta"
462,Assistant Professor
463,"Center of Higher Amazonian Studies (NAEA), Federal University of Para"
464,IBM T. J. Watson Research Center
465,"Associate Professor | Professeur Agrégé, Polytechnique Montréal (Université de Montréal campus)"
466,CEA
467,"Professor of Biochemistry, Annamalai University"
468,Phd. Molecular Life Sciences
469,"Geography and Geology, University of Hull"
470,IBM
471,"Landscape Architecture and Environmental Planning, University of Technology, Dresden"
472,"Head of Department of Genetics and Biotechnology, Ivan Franko National University of Lviv"
473,"Green Chemistry Centre of Excellence, University of York"
474,"Professore di Matematica, Università della Calabria"
475,"MackGraphe, Mackenzie Presbyterian University"
476,University of South Africa (Unisa)
477,Gümüşhane Üniversitesi
478,"Università degli Studi di Milano, Dipartimento di Scienze della Terra 'A. Desio'"
479,CSIR-CSIO
480,"PhD Scholar, Pusan National University"
481,"Asst. Prof., faculty of physical education, University of Sadat City"
482,"Harran University, Science Faculty, Department of Chemistry, Assoc. Prof. Dr."
483,"Department of Inflammation and Immunity, Lerner Research Institute, Cleveland Clinic, Cleveland, OH"
484,"Professor of Biochemistry, NYU School of Medicine"
485,University of California San Francisco
486,University of Queensland
487,"Associate Professor of Government, Berry College"
488,"Postdoctoral researcher, Laboratoire de Biorhéologie et d'Ultrasonographie Médicale, Montréal"
489,"Centre for Quantum Computation and Communication Technology, University of New South Wales"
490,"Ústav chemie, PřF MU"
491,Associate Professor Curtin Institute for Biodiversity and Climate
492,"National Center for Science and Engineering Statistics, NSF"
493,Pennsylvania State University and VMware Research
494,Senior Research Investigator
495,V R Siddhartha Engineering College Vijayawada
496,Universidade Federal do Rio Grande do Sul
497,"Research Fellow, National University of Singapore"
498,"PhD candidate, University of Stuttgart"
499,Université catholique de Louvain | UCLouvain
500,"Associate Professor, University of Alberta"
501,"Professor of Computer Science and Information Engineering, Chung Hua University"
502,"KACST, King Abdulaziz City for Science and Technology"
503,"Professor of Neurobiology and Neurosciences, University of California San Diego"
