affiliation_id,affiliation_name
7159,"William Bevan Professor of Mechanical Engineering and Materials Science (MEMS), Duke University"
7160,"Professeur, Université du Québec à Montréal"
7161,Dunarea de jos University of Galati
7162,Higher School of Economics
7163,ITB
7164,"IOR Institute of Oncology Research, Bellinzona, Switzerland"
7165,"North Carolina State University, College of Sciences"
7166,"Professor of Pharmacology and Toxicology, Michigan State University"
7167,"PhD Student, GoLP/IPFN, Instituto Superior Técnico"
7168,"Ibn khaldoun university ,Tiaret"
7169,"Institute of Atomic and Molecular Sciences, Academia Sinica"
7170,Thomas Straumann Professor für Materialwissenschaft in der Medizin
7171,"University of the Free State, South Africa"
7172,Technische Universität Braunschweig
7173,"Assistant Professor, University of Illinois at Chicago"
7174,IPGP
7175,PhD of Organic-Polymer Chemistry in Isfahan University of Technology
7176,"Professor of Physics, National Taiwan University"
7177,"Docente Catedratico, Investigador GESS, Universidad de Ibagué"
7178,Murdoch University
7179,"Professor of Chemistry, University of Chittagong"
7180,"Marcus Chaired Professor of Industrial Engineering, Penn State"
7181,Morgan State University
7182,"Research fellow, Heriot-Watt University"
7183,"Assistant Professor of Economics, University of New Mexico"
7184,NOAA Earth System Research Laboratory
7185,"Applied of biology, Dong-A University"
7186,Student of SZABIST Karachi
7187,"Associate Professor, Democritus University of Thrace"
7188,"Professor of Economic Geography, University of Groningen"
7189,University of Florida - Gulf Coast Research & Education Center
7190,Institute for Philosophy and Public Policy at George Mason
7191,"Institute of Basic Medical Sciences, University of Oslo, Norway"
7192,Universitatea Tehnica Cluj Napoca
7193,"Professor de Botânica, Universidade de São Paulo"
7194,"University Ss.Cyril and Methodius, Faculty of Economics - Skopje"
7195,University of North Carolina Wilmington
7196,"State Polytechnic of Malang, Indonesia"
7197,"Professor of Applied Mathematics, Colorado School of Mines"
7198,"Assistant Professor of Polymer Chemistry, School of Chemistry, Damghan University, Iran"
7199,"Professor de Bioquímica, Universidade Federal de São Paulo."
7200,Professor of Sungkyunkwan University
7201,"Dipartimento Biologia, Università di Roma Tor Vergata"
7202,"Associate Professor, Edward Via College of Osteopathic Medicine - Auburn Campus"
7203,Professor of medicine
7204,"Technische Universität Wien, Atominstitut"
7205,INRA BIOGER-CPP
7206,Nazareth College
7207,"Ladoke Akintola University of Technology, Ogbomoso, Nigeria"
7208,University of Mulawarman
7209,"Associate Prof, USIC&T, Guru Gobind Singh Indraprastha University"
7210,University of Port Harcourt
7211,Shahrekord University of Medical Sciences & Erasmus MC University
7212,Alector
7213,University of Calgary Haskayne School of Business
7214,Professora das Faculdades Integradas de Taquara
7215,"Lecturer, School of EAE, Monash University"
7216,Autonosys
7217,University of London
7218,"Associate Professor of Medicine, Harvard Medical School"
7219,"International University, Vietnam National University, Ho Chi Minh city, Vietnam"
7220,"Emeritus Professor of Environmental Science, Stirling University"
7221,Cerritos College
7222,Gandaki Medical College
7223,"Curatore Responsabile dell'Orto Botanico, Università della Calabria"
7224,"Indian Institute of Technology, Kanpur"
7225,Stevens Institute
7226,"Professor of Cyber Security at Deakin University, Australia"
7227,"Chemical Engineering, Stanford University"
7228,"Associate Professor, Aalborg University"
7229,STR
7230,professor of petroleum engineering university of texas at austin
7231,"Postdoctoral Research Fellow, University of Sydney"
7232,"Lecturer of Food Science, Zhaoqing Unversity; Postdoc in Hokkaido University"
7233,"Reseacher, University of Melbourne"
7234,"Professor de Geografia, Universidade Federal do Amazonas"
7235,"Associate Professor, Radboud University Nijmegen"
7236,"lecturer of arts,college of arts,tikrit university"
7237,Fundação Oswaldo Cruz
7238,"Thoracic Surgeon, Hospital de Clínicas de Porto Alegre, Hospital da Criança Santo Antônio"
7239,"The University of Sydney, School of Chemical and Biomolecular Engineering"
7240,Huaiyin Normal University
7241,Adjunct Faculty Western University
7242,Charles Darwin University
7243,"PhD Candidate Chemical Engineering, University of Melbourne"
7244,Visual Computing Institute - RWTH Aachen University
7245,"Professor of Educational Psychology, University of Trier"
7246,"Assistant Professor, New Mexico State University"
7247,Tech4Imaging LLC
7248,Dpto. Ingeniería Civil - Universidad de Alicante
7249,Eureka Science Solutions
7250,"Visual Analytics Specialist, CSIRO, Australia"
7251,Guru Jambheshwar University
7252,"Ph.D. Candidate / Betty and George Coates Fellow in Habitat Research, Caesar Kleberg Wildlife"
7253,"PhD student, Università degli Studi dell'Insubria"
7254,Universitatea Politehnica din Bucuresti
7255,"Ph.D. student of Entomology, University of California Riverside"
7256,"Investigator, Joslin Diabetes Center; Associate Professor, Harvard Medical School"
7257,National Research Center Cairo Egypt
7258,"Ondokuz Mayis University, Faculty of Veterinary Medicine"
7259,Estudiante Maestría Agroecología. Universidad del Medio Ambiente
7260,"Associate Professor of Biomedical Engineering, National University of Singapore"
7261,"Professor, Yale University"
7262,The Miriam Hospital & The Warren Alpert Medical School of Brown
7263,"Professor of Physics, University of Ottawa"
7264,Universidade Federal do ABC
7265,"Professor of Medicine and Therapeutics, The Chinese University of Hong Kong"
7266,"Assistant professor of Pathology, Urmia University of Medical Sciences"
7267,"Espiye Meslek Yüksekokulu, Giresun Üniversitesi"
7268,"Associate Professor of Medicine, University of Wisconsin-Madison"
7269,"PhD candidate, Macquarie University"
7270,AIT Austrian Institute of Technology
7271,University of California Irvine
7272,"Professor Titular aposentado, Fac. de Eng. Elétrica, Unicamp"
7273,Berry College
7274,FMVZ/USP
7275,Dublin Institute of Technology
7276,"Associate Professor of Biology, Chatham University"
7277,Professor of Biochemistry; University of Pecs; Medical School
7278,"Professor of Genetics, University of the Philippines Los Banos"
7279,Aalto University School of Engineering
7280,"Professor of Chemistry, University of Bucharest"
7281,"Department of Neurosurgery, Tazuke Kofukai Medical Research Institute and Kitano Hospital"
7282,"Scientist, ICAR-Indian Institute of soybean research, Indore"
7283,"Professor de Biologia, Universidade Federal de Campina Grande"
7284,"Post-doctoral Researcher, University of Cambridge"
7285,CSIC
7286,"Senior Engineer at  ITRI, Taiwan"
7287,Université du Québec à Trois-Rivières
7288,Zahedan University of Medical Sciences
7289,"Postdoc, Nuclear Physics Institute, Rez, Czech Republic"
7290,Universidade José do Rosário Vellano
7291,"archaeology, University of Southern Queensland"
7292,"Microbioogy and Immunology department, Faculty of medicine, Minia university"
7293,"Department of Chemistry,Amirkabir university of Technology (AUT).Iran."
7294,"Professor of Electronics Engineering, SVNIT"
7295,"Research Associate, Dept. of Civil Engineering, IISc Banglore"
7296,"Affiliate Professor, George Mason University"
7297,"South African National Bioinformatics Institute, University of the Western Cape, South Africa"
7298,"Genomic Service Coordinator, University of Queensland"
7299,"Tabriz University of Medical Sciences, Tabriz, Iran."
7300,"PhD Student in Social Work, The George Warren Brown School of Social Work, Washington University in"
7301,"Assistant Professor, Fu Jen Catholic University"
7302,"Research Associate, Harvard University"
7303,"Professor de Ciência da Computação, Instituto Federal de Mato Grosso"
7304,"Professor, Dept of Geography Education, Korea University"
7305,PhD at LAAS-CNRS
7306,CDC Division of Viral Diseases
7307,BASF Senior Manager Corporate Strategy & Portfolio Management
7308,"Neuroscience & Linguistics Undergraduate, Duke University"
7309,Central arid zone research institute
7310,"Professor, University of Messina, Italy"
7311,"Prof Assuntos Universitários, FEA/DEA, Universidade Estadual de Campinas"
7312,National Center for Advancing Translational Sciences (NCATS)
7313,"PhD Fellow, University of Crete, Department of Physics"
7314,"Postgraduate of Computer Science, Shanghai JiaoTong University"
7315,Universita' and INFN Bologna
7316,Universitat.Politècnica.de.Catalunya
7317,"Senior Scientist, Arthur Rylah Institute for Environmental Research"
7318,Professor for Textlinguistics and Technical Communication
7319,"Professor, Cranfield University"
7320,"Marine Science Institute, U C Santa Barbara"
7321,Brookhaven National Lab & Stony Brook University
7322,Institute for Ocean Conservation Science at Stony Brook University
7323,PhD Cyber Security
7324,Universidad Tecnológica de Panamá
7325,ICAR- CENTRAL SOIL SALINITY RESEARCH INSTITUTE REGIONAL RESEARCH INSTITUTE LUCKNOW
7326,中国地震局地质研究所
7327,"PhD student, leacturer"
7328,Temple University School of Medicine
7329,"School of Electrical Engineering, Southwest Jiaotong University"
7330,University of Medicine and Pharmacy Craiova
7331,"Professor for Health Education and Sport Psychology, Karlsruhe Institute of Technology"
7332,Eckerd College
7333,"Pontificia Universidad Javeriana, Ciencias Sociales"
7334,NIMS
7335,ITMO University
7336,Murdoch University and The University of Western Australia
7337,"Profesor, Universidad Nacional de Colombia"
7338,D D U Gorakhpur University
7339,Universidad Internacional de La Rioja
7340,École polytechnique fédérale de Lausanne
7341,Center for Applied Biotechnology Studies - California State University Fullerton
7342,"Department of Biochemical Engineering and Biotechnology, Indian Institute of Technology Delhi"
7343,Iora Health
7344,Indiana University - Kelley School of Business
7345,UDESC - Santa Catarina State University
7346,Staff Researcher CIBERER - Institut de Recerca de l’Hospital de la Santa Creu i Sant Pau
7347,"Professor of School of Electronics Engineering, College of IT Engineering, Kyungpook National"
7348,"Instituto de Radioastronomia y Astrofísica, UNAM"
7349,"Assiut University, Faculty of Medicine, Departement of Tropical Medicine and Gastroenetrology"
7350,"Department of Psychology and Sports Science, University of Giessen, GERMANY"
7351,"Assistant professor, Dept. of Cognitive Neuroscience, Maastricht University"
7352,F. Hoffmann-La Roche
7353,Saint Petersburg State University
7354,Professor of Physiology
7355,"Associate Professor of Political Science, Purdue University"
7356,Tata Steel Limited
7357,University of Sydney
7358,Associate Professor at Telecom parisTech
7359,Professeur de psychologie
7360,"Area Editor, Performance Journal; Former Full Professor, St. Petersburg University"
7361,National Chiao Tung University; CanTho University
7362,"Professor, University of Rochester Eastman Institute for Oral Health"
7363,MEA Forensic
7364,Max Planck Institute for Molecular Physiology
7365,"Professor of Pathology, ANU"
7366,Universidad Nacional Santiago Antúnez de Mayolo
7367,"Doctorando, Universidad Católica de Murcia"
7368,"Associate Professor, Boston College"
7369,Assistant Professor at Washington University in St Louis
7370,"Professor de Dentística, Universidade de São Paulo"
7371,"Associate Professor, School of Human Evolution & Social Change, Arizona State University"
7372,"Professor of Economics, Stanford Graduate School of Business"
7373,University at Buffalo The State University of New York
7374,"Ph.D. candidate in Mechanical engineering, University of Minnesota"
7375,"Professor, School of Mathematics and Statistics, University of Sheffield, Sheffield, UK"
7376,Sanofi R&D
7377,Staffordshire University
7378,"associate professor, university of Pennsylvania"
7379,CDC
7380,"Pesquisador Científico, Intituto Lauro de Souza Lima, Bauru-SP, Brasil"
7381,Trudeau Institute
7382,"Smt. Sharadchandrika Suresh Patil College of Pharmacy, Chopda, Jalgaon M. S."
7383,Researh assistant of Cincinnati Children's Hospital
7384,Jiangsu University
7385,"Associate Professor, Yamaguchi University"
7386,"Postdoctoral researcher, Technische Universität München"
7387,Professor of Linguistics and Brain and Cognitive Sciences
7388,Profesor Investigador. Universidad Autónoma del Estado de Hidalgo
7389,Washington University School of Medicine in St. Louis
7390,University of Bradford
7391,Catedrática CONACyT - UASLP
7392,"Associate Professor, BITS Pilani Hyderabad Campus"
7393,"Huawei Technologies, Inc."
7394,researcher Universita degli Studi di Trento
7395,"Professor of Polymer Engineering, Amirkabir University of Technology"
7396,"Professor (Assistant), Faculty of Medicine and Health Science, An-Najah National University"
7397,librarian
7398,Professor de Engenharia Civil
7399,Wilfrid Laurier University
7400,"Professor of Pharmacutics, Manipal College of Pharmaceutical Sciences, Manipal Universtiy"
7401,"College of Enterprise and Development, Otago Polytechnic"
7402,"Professor of Industrial and Systems Engineering, Liberty University"
7403,"Research and teaching assistant, Faculty of Electronic Engineering, University of Nis"
7404,PhD at University of Oslo
7405,"Professor, McMaster University"
7406,Scientist at Indian Space Reasearch Organization
7407,Institute of health and environmental medicine
7408,"​Edinburgh Medical School, The University of Edinburgh, ​United Kingdom"
7409,INDIAN INSTITUTE OF ENGINEERING SCIENCE AND TECHNOLOGY
7410,"associate professor of analytical chemistry,chemistry&chemical engineering research center of iran"
7411,"Research Officer, University of the Western Cape"
7412,"Literature Services, European Bioinformatics Institute"
7413,"Chair Professor and Head of Mechanical Engineering, Hong Kong Polytechnic University (B-8836-2008)"
7414,"Nanophysics, Istituto Italiano di Tecnologia"
7415,"Associate Professor of Mathematics, College of Science, University of Sharjah, UAE"
7416,Professor Titular da Escola de Química da UFRJ
7417,"Riphah International University, Lahore, Pakistan"
7418,"PhD Student, Australian National University"
7419,The Lunenfeld-Tanenbaum Research Institute
7420,Hunan University; TU Dortmund University; The University of Queensland
7421,Electronics Engineer
7422,"Professor Clinical Physiology Karolinska Institutet, Stockholm, Sweden"
7423,"Hospital Clinic, Barcelona & Universitat Autònoma, Barcelona"
7424,QIMR BERGHOFER
7425,University of santiago de compostela /PhD candidate
7426,Hydro-Quebec Research Institute
7427,"National Institute of Technology, Rourkela"
7428,Hydro-Québec
7429,"Research Aerospace Engineer, NASA Glenn Research Center"
7430,ASML
7431,Prof. Universidade Federal Rural de Pernambuco
7432,akdeniz üniversitesi tıp fakültesi
7433,Syntese (Ferring Pharmaceuticals) A/S
7434,"University of Twente, CHEPS"
7435,"Esther Elizabeth Brintzenhoff Professor of Medical Science, Brown University"
7436,Bush Heritage Australia; Biological Sciences Uni of Western Australia; Uni of Melbourne
7437,"Pharmacognosy and Phytochemistry, PhD ,            College of Pharmacy, King Saud University"
7438,"State Key Laboratory of Synthetical Automation for Process Industries, Northeastern University"
7439,Associate Professor University of Bergen
7440,"Professor of Ophthalmology, University of Birmingham"
7441,University of Oulu
7442,Assistant Professor at Rose-Hulman Institute of Technology
7443,CSIRO Mineral Resources
7444,"Chemistry Education Department, Islamic University of Kalimantan."
7445,"Professor, PhD-PEng.  SDU, MMR&R Research Group"
7446,"Profesor, Universidad Autónoma de Madrid"
7447,FU Berlin
7448,"College of Chemistry and Molecular Engineering, Peking University"
7449,"AllGenetics & Biology, SL"
7450,Universitätsspital Basel
7451,Head - Dept. of Informatics - Pontifical Catholic Univ. of Rio
7452,"Professor, Faculty of Pharmaceutical Sciences, Sojo University"
7453,"Associate Professor of Electrical Engineering, Zhejiang University, PRC"
7454,The Hague University of Applied Sciences
7455,The University of Portsmouth
7456,"Professor of Surgery, University of Hong Kong"
7457,"Assistant Professor, University of California, Merced"
7458,"Senior Lecturer, School of Engineering and Computer Science, Victoria University of Wellington"
7459,"Business School, Pontificia Universidad Católica de Chile"
7460,"Professor of Biophysics, Queen Mary University of London"
7461,"South Asian University, New Delhi"
7462,"Earl P. and Ethel B. Koerner Chair in Business, Tulane University"
7463,"Mechatronics Eng., Pontifical Catholic Univ. Parana (PUCPR), and Electrical Eng., UFPR"
7464,"Endowed Dudley J. Hughes Chair in Geology and Geophysics, Texas A&M University"
7465,"Faculty of Physics, University of Barcelona"
7466,"Professor of Computer Science, Jingdezhen Ceramic Institute"
7467,Toyota Research Institute
7468,"Assoc. Prof., Tokyo Institute of Technology"
7469,"Professor, Griffith University"
7470,Istanbul Medipol University
7471,Tecnológico Nacional de México
7472,"MEXT Excellent Young Researcher, Assistant Professor, Muroran Institute of Technology (室蘭工業大学)"
7473,University of Windsor
7474,"Associate Professor, Division of ECE. Netaji Subhas Institute of Technology, Sector-3, Dwarka, New Delhi-110078, INDIA"
7475,"Assistant Professor, City University of New York"
7476,"Peter MacCallum Cancer Centre, Melbourne"
7477,DeeplyCurious.ai
7478,"Professor of Marketing, Arizona State University"
7479,Università Politecnica delle Marche Dep. SIMAU
7480,"CREA, Consiglio per la ricerca in agricoltura e l'analisi dell'economia agraria"
7481,university of  maryland college park
7482,"Post-doctoral fellow, SensorLab, University of the Western Cape"
7483,Investigadora do INIAV
7484,Radiation Oncologist. Istituto Clinico Humanitas - Humanitas Cancer Center. Radiotherapy & Radiosurgery
7485,中国科学院宁波材料技术与工程研究所
7486,"Professor, Doctor (PhD), UNIVERSITI PUTRA MALAYSIA, FACULTY OF MEDICINE AND HEALTH SCIENCES, DEPT OF"
7487,UNIVERSITY OF ALICANTE
7488,"Associate Professor, Kore University of Enna"
7489,"Graduate Student, Tufts University"
7490,IF Sudeste MG
7491,"professor of Industrial Engineering, Iran University of Science and Technology"
7492,"Analista de TI, Universidade Federal do Pampa"
7493,Fujita Health University School of Medicine
7494,"Lecturer, College of Environmental Engineering, Imam Abdulrehman bin Faisal University (University"
7495,Insight Centre for Data Analytics
7496,NYU School of Medicine
7497,"(Honorary) Professorial Fellow,Global Development Institute, University of Manchester"
7498,"Progenika Biopharma, a Grifols company"
7499,Postdoctoral Researcher at Friedrich Miescher Institute
7500,"Instructor, St. Charles Community College"
7501,"Professor, University of Maryland, College Park"
7502,"Larry R. Faulkner Endowed Chair in Chemistry, University of  Illinois at Urbana-Champaign"
7503,"Senior Lecturer, Centre for Human Rights Education, Curtin University"
7504,"Professor of English, Northeastern University"
7505,Lawrence Livermore National Laboratory
7506,Professor at University of Tehran
7507,Heinrich-Heine-Universität Düsseldorf
7508,FHCRC
7509,assistant professor in Pediatrics
7510,"Department of Chemical Engineering, Pohang University of Science and Technology"
7511,Universidad de Ciencias Aplicadas y Ambientales U.D.C.A
7512,"Senior Lecturer, Theoretical Physics, Imperial College London"
7513,Università di Bologna
7514,"Professor, University of Miami"
7515,"Professor of psychology, Pennsylvania State University"
7516,"College of Earth, Ocean and Environment  (University of Delaware)"
7517,Associate Professor Chalmers University of Technology and Researcher at SP Technical Research
7518,"Political Science, Georgia State University"
7519,"CIMMYT-Southern Africa, Zimbabwe"
7520,Principal Lecturer Sheffield Hallam University
7521,"Assistant Professor, George Wasgington University, Washington, DC"
7522,"Professor of Biology, Colorado State University"
7523,"Senior Research Scientist, Georgia Institute of Technology"
7524,Lodz University of Technology TUL
7525,"Federal University Lafia, Nigeria"
7526,"Associate Professor of New Media Technology, LaGuardia Community College"
7527,US Naval Research Laboratory
7528,"Amity Institute of Microbial Biotechnology, Amity University, Noida; Indian Agricultural Research"
7529,"Postdoctoral Researcher, George Mason University, University of Pennsylvania"
7530,Department of Bioresource and Environmental Sciences
7531,"Professor of Medicinal Chemistry, Shandong University"
7532,Professor Livre Docente do curso de Fisioterapia da Faculdade de Medicina da USP
7533,"professor of electrical engg ,Anna University"
7534,"current: comp-arch.net, Imagination/MIPS; old: Intellectual Ventures, Intel, AMD, Motorola, Gould"
7535,"Director, ASU NanoFab, and Prof., School of Electrical"
7536,"Associate Professor, Anesthesiology, University of Utah"
7537,"Charge de Recherche C2N/CNRS, Paris-Saclay"
7538,"Helmholtz-Zentrum Dresden-Rossendorf, Research site Leipzig, Leipzig, Germany"
7539,Profesor de Creación de Empresas y Business Plan
7540,"Professor of Organization and Business Ethics, Northumbria University"
7541,"Docent (Associate Professor), University of Borås; Senior Research Fellow, Curtin University"
7542,"Institute of Mathematics, National Academy of Sciences of Ukraine"
7543,"Institute for Science, Law and Technology"
7544,Professor do Departamento de Contabilidade da FEA-RP da Universidade de São Paulo.
7545,Université de Corse
7546,Investigadora CIOCC
7547,"Research Associate, Cornell University"
7548,"Professor of Civil Engineering, Shanghai Jiao Tong University; Adjunct Professor, Swinburne University of Technology"
7549,"Instituto Federal de Educação, Ciência e Tecnologia do Rio Grande do Norte"
7550,"Associate Professor of Mathematics, University of Waikato"
7551,"Email: ashikcivil@yahoo.com; Department of Civil Engineering, University Putra Malaysia"
7552,Medical Student
7553,"Associate Professor of Computer Science, Lebanese American University"
7554,"PhD (candidate) Department of Law and Legal Studies, Carleton University"
7555,"Distinguished Professor of Pharmaceutical Sciences, Al-Quds University"
7556,Los Angeles County & University of Southern California Medical Center
7557,"Senior Researcher, Hungarian Academy of Sciences"
7558,"1) Senior Consultant, NIH/CSCMi-IGH, Rourkela,  (2) Professor & Dean, AIPH, Bhubaneswar India"
7559,Bredesen Center: University of Tennesee
7560,"Assistant Professor, Rochester Institute of Technology"
7561,NASA Glenn Research Center
7562,"PhD student of Biomedical Engineering, Cornell University"
7563,Docente Departamento de Química Universidad Militar Nueva Granada
7564,CNR-ISTI
7565,Poznan University of Technology
7566,Estudiante de la Universidad de Guinea Ecvuatorial
7567,Pontificia Universidad Católica de Chile
7568,Swiss Federal Research Institute WSL
7569,PhD Student University of Miami
7570,"Professor of Organic Geochemistry, Plymouth University"
7571,"Phd in mechanical engineering, National Iranian Gas Company"
7572,FMRP USP
7573,Joukowsky Institute for Archaeology and the Ancient World
7574,Norwegian Geotechnical Institute
7575,"Shenyang National Laboratory for Materials Science, Institute of Metal Research, CAS"
7576,UAHuntsville
7577,"Senior Lecturer,  Department of Educational Psychology, Kenyatta University"
7578,"Professor of Library and Information Science, University of Borås"
7579,Airbus Defence and Space GmbH
7580,Sulaiman AlRajhi School of Business
7581,National Measurement Institute Australia
7582,"Associate Professor of Computer Science, Sam Houston State University"
7583,Champalimaud Centre for the Unknown
7584,"Distinguished Professor of Psychological Sciences, Purdue University"
7585,"International Center for T1D, Pediatric Clinical Research Center Romeo ed Enrica Invernizzi"
7586,Chemical Engineer/Scientist
7587,"Saarland University, Chair of Clinical Psychology and Psychotherapy"
7588,"Associate Professor, MRC-PHRU at the University of Oxford"
7589,communication system engineer
7590,Uni. of Sydney
7591,"Bocconi University, Milan, Italy"
7592,Pasteur institute of iran
7593,Institute of Organic Chemistry with Centre of Phytochemistry (IOCCP)
7594,"Xi'an Jiaotong Univ., Beijing Univ. of Posts and Telecomm."
7595,"Assistant Professor, Geobotany, Martin-Luther-University Halle-Wittenberg"
7596,Associate Professor of French & Linguistics
7597,"Institute of Psychiatry, King's College London"
7598,"Associate Professor, Industrial Engineering Dept., Pontifical Catholic University of Rio de"
7599,"Full Professor, University of Cagliari"
7600,"Associate Professor of Human Development and Family Sciences, Oregon State University"
7601,Trier University
7602,"Mestranda em Ciências do Exercício e do Esporte, Universidade Gama Filho"
7603,Sam Houston State University
7604,Research Centre for Natural Sciences
7605,"research associate, Faculty of Veterinary Medicine, Belgrade University"
7606,"Lecturer in Marketing, Charles Sturt University"
7607,"PhD Candidate at Computer Science and Engineering, Arizona State University"
7608,"Max-Planck-Institute for Biogeochemistry, Jena, Germany"
7609,"University Hospitals of North Midlands, University Hospitals Birmingham NHS Trust, Keele University"
7610,associate professor
7611,Pohang University of Science and Technology
7612,"Associate Professor, University of Antofagasta, Chile "
7613,albert einstein college of medicine
7614,"Immunology, MD Anderson Cancer Center"
7615,"Professor of Electrical Engineering and Computer Sciences, University of California, Berkeley"
7616,"Post-doc, Weizmann Institute of Science"
