affiliation_id,affiliation_name
4840,University of the Sunshine Coast
4841,Washington University
4842,"Professor of Chemical and Biomolecular Engineering, Professor of Molecular Physiology and Biophysics"
4843,Mahindra Ecole Centrale
4844,Sonoma State University
4845,"Professor of Hiroshima Synchrotron Radiation Center, Hiroshima University"
4846,"Osaka Municipal technical Research Institute, Electronic Materials Division"
4847,Professor and ARC Future Fellow
4848,"PhD for Mechanical Engineering, Politeknik Sultan Salahuddin Abdul Aziz Shah, Malaysia"
4849,Twitter: @bleedingstroke
4850,"Professor of Education, Universidad de Costa Rica"
4851,Farmacia J.D. Carballeira - Universidad de Granada
4852,"Assistant Professor of Political Science, Drury University"
4853,"Fachbereich Mathematik, Universität Tübingen"
4854,"Professor of Political Science, University of Wisconsin-Milwaukee"
4855,tecnologo em radiologia
4856,Università della Campania 'Luigi Vanvitelli'
4857,University of Hawaii
4858,"Professor - Economics, Franciscan University (UFN)"
4859,"Department of Pharmacodynamics, Semmelweis University"
4860,University of Massachusetts Lowell
4861,"Professor of Physical Chemistry, RWTH Aachen University"
4862,"Postdoctoral Researcher, AHP University of Lorraine and IHPST Paris 1"
4863,Estudiante Maestría en Desarrollo Regional y Planificación del Territorio
4864,Wright State University
4865,"Associate Professor, Shih Hsin University"
4866,"Institute of Biophysics, Chinese Academy of Sciences"
4867,professeur
4868,"UC Berkeley, Reax Engineering"
4869,Ph.D
4870,T. C. Colege Baramati
4871,Інститут управління і права НЮУ ім. Я. Мудрого
4872,"CECAD, University of Cologne, Germany"
4873,Profesor de Tecnología de la Arquitectura. Universidad Politécnica de Cataluña
4874,"State Key Lab of Bioelectronics, Southeast University"
4875,Bank of England
4876,Telecom ParisTech
4877,"Professor of Business Administration, Chongqing University"
4878,"Associate Professor of Mechanical Engineering, Amrita Vishwa Vidyapeetham (Amrita University)"
4879,Genome Institute of Singapore
4880,"IN+, LARSyS, IST, Universidade de Lisboa"
4881,Samsung Display
4882,Cardiff & Utrecht Universities
4883,Łódź University of Technology
4884,"Division Director, Materials Science and Engineering, Ames Laboratory and Professor Materials Science and Engineering, Iowa State University"
4885,Spatial Foresight
4886,"Professor, Michigan State University"
4887,Universiteit Gent/Vlaams Instituut Biotechnologie
4888,Atılım Üniversitesi
4889,Directeur de Recherche INSERM
4890,NJMS Molecular Resource Facility
4891,Full Professor at Pablo de Olavide University
4892,"Professor of Arachnology, Southwest University"
4893,"Assistant Professor of Supply Chain Management, Shippensburg University"
4894,Ph.D. Student University of Auckland Institute of Marine Science
4895,Chemistry Professor University of Crete
4896,"Professor of Neurobiology, Washington University at St. Louis"
4897,"Professor of Management, Middle Tennessee State University"
4898,LIP6
4899,"Associate Prof., Water Resources Eng., Physical Geography Department, University of Tehran, P.O. Box"
4900,"Associate Professor of Physics, Kafkas University"
4901,Head of Strategic Communications at HAMK
4902,"Centre for Mathematical Sciences, Lund University"
4903,"School of Energy and Power Engineering, Chongqing University"
4904,Agriculture and Agri-Food Canada
4905,bell labs
4906,"Postdoc, Fritz Haber Institute"
4907,University of Saskatchewan
4908,"Professor of Economics, University of Regina"
4909,"Professor, The Chinese University of Hong Kong"
4910,"Regional Representative for ICRAF- South Asia, World Agroforestry Centre; CGIAR"
4911,GIS and Remote Sensing Group. Universidad de Castilla-La Mancha
4912,Tohoku University
4913,University of Texas Houston Department of Neurology
4914,"Assistant Research Fellow at Institute of Information Science, Academia Sinica"
4915,"Институт спектроскопии РАН; Физический институт им П.Н.Лебедева; МФТИ, факультет проблем физики и"
4916,"Biology Department, Can Tho University"
4917,Loughborough University London
4918,"Professor of Hydrometallurgy and Mineral Processing, University of Johannesburg"
4919,"School of Human Movement and Nutrition Sciences, The University of Queensland"
4920,"Schwartz School of Business, St. Francis Xavier University"
4921,"Ricercatore, Università di Bologna"
4922,Graduate research assistant at Wayne State University
4923,"Agronomy & Plant Genetics Department, University of Minnesota"
4924,Catalan Institute for Water Research (ICRA)
4925,"Public Health Agency of Canada, National Microbiology Laboratory"
4926,University of Montpellier
4927,Associate Professor in Management at University of Palermo
4928,"Research Forester, USDA Forest Service Pacific Northwest Research Station"
4929,University of Minnesota (formerly Los Alamos National Laboratory)
4930,"Senior Curator of Vertebrates, National Museums Scotland, Edinburgh"
4931,"Institute of Psychology, Jagiellonian University, Kraków, Poland"
4932,"Institut für Mikrostrukturtechnik, KIT"
4933,University of Milan
4934,"Prof., Anatomy Department, Faculty of Medicien, Tanta University, Egypt-Taibah University, Saudi"
4935,University of Wisconsin-Madison
4936,"Associate Professor, Electrical and Computer Engineering, The Ohio State University"
4937,"Assistant Professor of Medicine, Northwestern University"
4938,"Senior Scientific Software Engineer,  University of Edinburgh"
4939,Hunan First Normal University
4940,Professor at Ulm University
4941,Rakuten Institute of Technology
4942,"Professor of Control Engineering, Ain Shams University, Cairo, Egypt"
4943,"Guangzhou University,Tsinghua University,South China University of Technology"
4944,Universidad Técnica Particular de Loja
4945,Harbin Engineering University
4946,DuPont
4947,Syracuse University London
4948,"PhD candidate, BGU"
4949,Prof. of molecular biology
4950,Clinical Research/Pharmacology
4951,"Professore Ass. di Elettrotecnica, Università degli Studi di Firenze"
4952,Lecturer at the University of Liverpool
4953,"Professor of Statistics, Duke University"
4954,"Assistant Professor, University of California Berkeley; Faculty Scientist, Lawrence Berkeley"
4955,"Senior Staff Research Scientist, Intel Labs China"
4956,Zhejiang University of Technology
4957,Intel
4958,"Principal Research Fellow, Southampton University"
4959,"University of Technology, Malaysia"
4960,"Professor of Mechanical Engineering, JinLing Institude of Tecnology"
4961,Ewha Womans University
4962,Uludag University
4963,SERENADE Research Chair - Assistant Prof. Institut Mondor de Recherche Biomédicale - IMRB  Inserm
4964,"Professional Research Assistant, University of Colorado"
4965,"Professor of Education and Music Education, University of Hamburg"
4966,ITT Montani
4967,Massey university
4968,ONERA - Office National d'Études et de Recherches Aérospatiales
4969,Professor of MIS. Affiliations: University of Arizona and Chinese Academy of Sciences
4970,Medical University of Lublin
4971,Professora de Química - UNILAB
4972,Universidad Autonoma de Coahuila
4973,Univ. of Maryland College Park
4974,"Lecturer, Economics and Related Studies, University of York"
4975,"Professor,The University Of Jordan"
4976,"PhD Scholar, Indian Veterinary Research Institute"
4977,"Distinguished Faculty, Leadership for Higher Education, Capella University"
4978,Centers for Disease Control and Prevention
4979,Link Engineering Company; Michigan State University
4980,"Associate Professor of Pediatrics, University of Toronto"
4981,"Department of Paediatric Cardiac Surgery, University of Bologna"
4982,"Associate Professor of Energy, Asian Institute of Technology"
4983,Okinawa Institute Of Science and Technology
4984,Lehrstuhl für Theoretische Chemie
4985,"Senior scientist, Schrödinger Inc."
4986,"Xinyuan Chair Professor of Finance, Tsinghua University"
4987,"Chief Engineer, Bastille Networks"
4988,University of West London
4989,"Graduate Student, University of Illinois at Urbana Champaign"
4990,"University Distinguished Professor, University of Tennessee Health Science Center, Memphis"
4991,University of Toyama
4992,"Professor Titular, Universidade Federal do Rio Grande do Norte Natal-RN"
4993,"The Ruth and Bruce Rappaport Faculty of Medicine, Technion - Israel Institute of Technology"
4994,"Centro de Innovación y Desarrollo Tecnológico en Cómputo, Instituto Politécnico Nacional, México"
4995,Aix-Marseille Université
4996,Principal Lecturer
4997,"University Hospital of Basel, Swiss Transplant Cohort Study"
4998,Neurologist
4999,"Klinik für Anästhesiologie, Universitätsmedizin Göttingen"
5000,"Assistant Professor of Computer Science, Cassino University"
5001,Professor of English and Anthropology
5002,"Professsor Emeritus, Biological Sciences, University of Texas at El Paso"
5003,"Research Fellow, University of Glasgow"
5004,"Professor, School of Meteorology, University of Oklahoma"
5005,University of California Berkeley
5006,"Dr. of Biopharmacy, University of Malaya"
5007,"PhD Student, George Mason University"
5008,Animal Health Research Institute
5009,"Universitat de València, Universitat Jaume I"
5010,"PhD student, University of Washington"
5011,"Department of Microbial Pathogenicity Mechanisms, Hans Knöll Institut, Leibniz Institute for Natural"
5012,"Department of Electrical Engineering and Information Technology, Faculty of Engineering, UGM"
5013,CZ Biohub
5014,University of Zaragoza
5015,Tianjin Medical University
5016,"University of the Free State, Bloemfontein, South Africa"
5017,"JCMwave.com, ZIB"
5018,"Assistant Professor, University of Missouri-Columbia"
5019,"Phd Candidate of Industrial and Management Systems Engineering, Kyung Hee University"
5020,U.S. Food and Drug Administration
5021,"Applied Materials, Intel, Stanford University, The University of Texas at Austin, Texas Instruments"
5022,"Professor of Medicine and Public Health, Boston University"
5023,"Assistant Professor, Princeton University"
5024,Max Planck Institute for Evolutionary Biology
5025,International Center for Tropical Agriculture (CIAT) and CCAFS
5026,"Université de Montpellier, UMR CEFE"
5027,"Professor of Economics, Duke University"
5028,Gordon Life Science Institute
5029,"Department of Neurosurgery, Gyeongsang National University School of Medicine, Jinju, Korea"
5030,National Audubon Society
5031,"Research Engineer , Hewlett Packard Labs"
5032,University of Liverpool
5033,University of Szczecin 
5034,"Mahavir Cancer Institute and Research Centre, Patna, Bihar, India"
5035,Neurotrack Technology Inc.
5036,"Reader in Environment and Culture, Lancaster University"
5037,"Associate Professor of School of Materials Science and Engineering, GIST"
5038,Boston College
5039,Qatar University
5040,"Faculty of Mechanical Engineering, University of Belgrade, Serbia"
5041,"Assistant Professor of Music, Webster University"
5042,The University of Utah
5043,Instituto Nacional de Salud Pública
5044,Scripps Research Institute
5045,"ANAS-ARO-USDA-ARS (PU, KSU) -Tottori University"
5046,Gramercy Research Group
5047,Universidad de Málaga
5048,Asia Pacific Center for Theoretical Physics
5049,Post-doctoral researcher at Northwestern University
5050,Gazi University
5051,"Aligarh Muslim University, Aligarh, India"
5052,"Professor of Biological Engineering, University of Arkansas"
5053,University of Luxembourg and Luxembourg Institute of Socio-Economic Research
5054,"Anhui Medical University;Menzies Institute for Medical Research, University of Tasmania"
5055,"Apple Inc., Ph.D. University of Michigan"
5056,"Assistant Professor, Department of Psychology, Arizona State University"
5057,"Professor of Political Science, Columbia University and Tel Aviv University"
5058,VIB-KU Leuven
5059,"professor of urban planning, Chung-Ang university"
5060,lecture of fish diseases and management zagazig university
5061,"Senior Researcher, University of Kaiserslautern"
5062,"Dom Luiz Institute, University of Beira Interior"
5063,"Adam Mickiewicz University, Faculty of Chemistry"
5064,"Assistant Professor, Stony Brook University"
5065,IANIGLA. CONICET
5066,Professor at University of Auckland
5067,Cold Spring Harbor Laboratory
5068,"Assistant Professor, University of Tehran "
5069,Loughborough University (Department of Geography and Environment)
5070,Universität Passau
5071,"Assistant Professor, School of Social Work, The University of Texas at Arlington"
5072,"Professor, The Evergreen State College"
5073,"Professor of Materials Engineering , Shiraz University"
5074,Prince Mohammad Bin Fahd University
5075,"Asst.prof of Biotechnology,Modern college,pune"
5076,"Assistant Professor, Indiana University"
5077,Médico psiquiatra Consorci Hospitalalry Vic
5078,"Adjunct Professor, University of Rochester"
5079,"Augusta University, Cairo University"
5080,NISER Bhubaneswar
5081,"Acculation, Inc."
5082,Sunkyunkwan University
5083,"Programa de Pós-Graduação em Engenharia Biomédica, Universidade de Brasília (UnB), Faculdade Gama"
5084,"National Tsing Hua University, Institute of Nanoengineering and Microsystems"
5085,Mount Sinai
5086,"Data Scientist, University of the Witwatersrand, Johannesburg"
5087,"Additional Professor, National Brain Research Centre, India"
5088,Luleå University of Technology
5089,"Professor, Hallym University"
5090,Indian Institute of Technology Kharagpur
5091,Master Student of Columbia University
5092,"Professor de Endodontia, Universidade do Sagrado Coração (USC)"
5093,Center for Space and Remote Sensing Research
5094,"Software Technology and Artificial Intelligence Research Lab, Chiba Institute of Technology"
5095,Düzce Üniversitesi
5096,"Director, Wales Academy for Physical Literacy, University of Wales Trinity Saint David"
5097,PlusAI
5098,"Biostatistician, Karolinska Institute"
5099,Professor Rice University
5100,"The Charles Pitts Robinson and John Palmer Barstow Professor of Applied Mathematics, Brown U"
5101,UCM
5102,ZEW
5103,"Assistant Professor, School of Computer Science, University College Dublin, Ireland"
5104,"Ingénieur de recherche, LGIPM, université de Lorraine"
5105,National Institute of Info.&Comm. Tech. (NICT) or Chinese Univ. of Hong Kong (CUHK) or Chalmers Univ
5106,"Professor of Electrical and Computer Engineering, Virginia Tech"
5107,Penn State Berks
5108,"professeur d'informatique, université de Lorraine"
5109,Arkansas Neuroscience Institute
5110,"Centre for Space Research and Applications (CESRA), FUTA"
5111,"PhD Student, Università di Napoli Federico II, CNR-IMM Naples, TVP Solar"
5112,Federal University of Technology Akure
5113,CEO of Speech Innovation Consulting Group
5114,"M.D. University, Rohtak"
5115,Distinguished Professor of Environmental Science and Engineering
5116,Mongolian National University of Medical Sciences
5117,Profesor de INvestigación
5118,"LEGOS, OMP, CNRS"
5119,"Associate Professor, Department of Experimental Psychology, University of Oxford"
5120,Putian University
5121,"Dept. of Physics & Photon Science, GIST, South Korea"
5122,Researcher of analytical chemistry inNational Organization for Drug Control and Research (NODCAR)
5123,Dr
5124,Taichung Veterans General Hospital
5125,Departamento de clinica Médica da Faculdade de Medicina de Ribeirão Preto - universidade de São Paulo
5126,Institut für Didaktik und Ausbildungsforschung in der Medizin
5127,PhD @ The Chinese University of Hong Kong
5128,"Institute of Tropical Aquaculture, Universiti Malaysia Terengganu"
5129,IBPM RAS
5130,"Lille 2 University, McGill University, EA7366"
5131,Postdoctoral Research Fellow
5132,"Assistant Professor of Psychiatry, Larner College of Medicine, University of Vermont"
5133,Clean TeQ
5134,"Swiss Light Source, Paul Scherrer Institut, Switzerland"
5135,"Public Policy/Criminology, Pepperdine University"
5136,Seonam University
5137,Instituto Butantan
5138,"Lecturer of Gyenaecology , Mbarara University of Science and Technology"
5139,"Medical Student, University of Toledo"
5140,Saint Louis University
5141,"Department of Chemical Engineering, Faculty of Engineering, University of Kashan"
5142,Queen Mary University London
5143,"Professor of Pathology, University of Agriculture Faisalabad"
5144,"Department of Medicine - University of Padova, Italy"
5145,CGG
5146,Philipps-University Marburg
5147,"PhD student, MBB. Karolinska Institutet, sciIfeLab"
5148,"Depatment of Materials Science and Engineering, Seoul National University"
5149,"Assistant professor of occupational health engineering,Isfahan university of medical science"
5150,Professo of Penn State University
5151,"Professor für Medizin, Mainz University"
5152,"Professor associado, Universidade de Brasília"
5153,"School of Life Sciences,  Jawaharlal Nehru University, New Delhi"
5154,University of Guilan
5155,Department of Biochemistry & Molecular Biology
5156,"Guangzhou Shiyuan Electronics Co.,Ltd"
5157,"MUTATION BREEDING LABORATORY, DEPARTMENT OF BOTANY, ALIGARH MUSLIM UNIVERSITY,ALIGARH-202 002,INDIA"
5158,Columbia University; National Center for Children & Families
5159,"Departamento de Química Anaítica, Universidad de Cádiz"
5160,"Postdoc Research Fellow, University of Queensland"
5161,"Hubble Fellow, The Ohio State University"
5162,"PhD, University of Missouri, AbbVie"
5163,University of Leeds
5164,U.S. Geological Survey (retired)
5165,"Ophthalmologist, Universidad Autónoma de Bucaramanga"
5166,eli lilly
5167,"Research Associate, Natural and Built Environment Research Centre, University of South Australia"
5168,"University of  West London, Associate Professor in Human Centred Systems. ITI / Larsys"
5169,"Professor in Political Communication & Journalism, Bangor University"
5170,McGill University (Retired 2015)
5171,"Professor of Finance, Auburn University"
5172,"Senior researcher, Korea Institute of Industrial Technology"
5173,"Ohio State University, OARDC"
5174,korea university
5175,"Senior Scientist, iBio CMO"
5176,"Professor and Dean, Gordon F. Derner School of Psychology, Adelphi University"
5177,Student at Georgia Institute of Technology
5178,"Postdoctoral Researcher, University of Pennsylvania."
5179,"Professor of Mathematics, University of Tasmania"
5180,"Associate Professor, Auburn University"
5181,"Senior Lecturer, The Open University"
5182,"Associate Professsor in Telecommunications, ESEN @University of Manouba"
5183,BC Cancer / University of British Columbia
5184,Netmarble IGS
5185,Universidad de Magallanes
5186,University of Wisconsin - Madison
5187,"Researcher in Center for Sustainable Development, at University of Brasília"
5188,"Professor of Finance, Kobe University"
5189,Henry Ford Health System
5190,Ulster University
5191,"Investigador Titular C ( CIEco, UNAM)"
5192,"Department of Economics, Goddard School of Business, Weber State University"
5193,MSc
5194,"Professor of Medicine,Dean Faculty of Clinical Sciences,  Bayero University Kano and Aminu Kano"
5195,Electrical and Computer Engineering-University of Houston
5196,"Vita-Salute San Raffaele University and San Raffaele Scientific Institute, Milan, Italy"
5197,"Universidade de Lisboa, Instituto Superior de Agronomia, Lisbon, Portugal"
5198,"асистент кафедри терапевтичної стоматології,Тернопільський державний медичний університет імені І.Я"
5199,"Professor of Plant Physiology, Texas A&M AgriLife Research"
5200,osaka university
5201,"Research fellow, UiT the Arctic University of Norway"
5202,"Professor of Surgery, Harvard Medical School"
5203,Gangnam severance hospital
5204,"Senior Lecturer in Coastal Geosciences, Flinders University"
5205,"Entrepreneurship and Strategy, Ted Rogers School of Management, Ryerson University"
5206,"Professor of Astrophysics, Universita' del Salento, Italy"
5207,Professor in Anatomic Pathology
5208,pesquisador faculdade de educação
5209,Bioquímico
5210,Interactions Labs
5211,"Docente Permanente, Mestrado em Desenvolvimento Socioeconômico, UNESC, Brazil"
5212,"Professor of Enterprise Information Systems, University of Lorraine"
5213,"Sr.Professor and advisor, S.A.ENGINERING COLL"
5214,Professor of Geotechnics - Université de Lorraine - France
5215,Regents Professor of Optical Sciences and Medical Imaging
5216,"Wellman Center, Massachusetts General Hospital, Harvard Medical School"
5217,"ICAR Research Complex for Eastern  Region,Patna"
5218,"Post-doctoral Research Fellow, University of Western Australia"
5219,"Joezy Griffin Professor of Small Animal Medicine, Auburn University"
5220,British Psychological Society
5221,Christensen Statistics
5222,"Professor of English, Yeshiva University"
5223,Sheppard Clinic North
5224,Johannes Kepler University of Linz
5225,Assistant Professor of Computer Science - Nile Valley University
5226,"Professor of Wood Science & Technology, Kwame Nkrumah University of Science and Technology"
5227,"Institut Curie - Orsay, France"
5228,"Associate Prof. of Physics, Peking University"
5229,"Assistant professor, Pontificia Universidad Javeriana - Cali ORCID:0000-0002-2888-953X"
5230,"Institute of Molecular and Cell Biology (IMCB), A*STAR"
5231,UNSW/SIMS
5232,Житомирський національний агроекологічний університет; кафедра бухгалтерського обліку
5233,Jerusalem College of Technology
5234,Shahid Rajaee Teacher Training University
5235,ROVIRA I VIRGILI UNIVERSITY
5236,"Professor de graduação e Pós-Graduação, Universidade Federal Rural do Rio de Janeiro"
5237,"Non-permanent Staff scientist, GEOMAR Helmholtz Centre for Ocean Research"
5238,"Postdoctoral Scholar, Lawrence Berkeley National Laboratory"
5239,University of Prince Edward Island
5240,"Post-doctoral researcher, Eawag,  Center for Ecology, Evolution and Biogeochemistry"
5241,"Pesquisadora em Espectrometria de Massas e Produtos Naturais de Plantas e Microrganismos, UFPR"
5242,Steno Diabetes Center Copenhagen
5243,Doctor en Ciencias
5244,Yonsei University
5245,"Scientist at the Institute of Chemical and Engineering Sciences, Singapore"
5246,PSG INSTITUTE OF MEDICAL SCIENCES  RESEARCH
5247,"Scientific Advisor, Schlumberger-Doll Research"
5248,"Professor of Early Childhood Special Education, University of Nevada Las Vegas"
5249,"Associate Professor, Pennington Biomedical Research Center"
5250,Duksung Women's University
5251,Memorial Sloan Kettering
5252,COSMONiO | NHL Stenden | IncubAI
5253,"University of Massachusetts Medical School, Cornell University"
5254,Bristol University
5255,"UD Media Studies, Erasmus University Rotterdam"
5256,"Postdoctoral Researcher, ETH Zürich"
5257,"Ph.D. candidate, University of Maine"
5258,Institute of Bioinformatics and Biotechnology
5259,"Scientist, NGRI(CSIR), Hyderabad, India"
5260,"Research Hydrologist, USDA Forest Service; Professor, College of Earth, Ocean, and Atmospheric"
5261,"THETA Collaborative, UHN & Assistant Professor (part-time), McMaster University"
5262,"Professor of Telecommunications, Warsaw University of Technology"
5263,"Research Institute on Addictions, University at Buffalo"
5264,"Department of Psychology, University of Essex."
5265,CARE International
5266,"Lecturer, Department of Product Development, Faculty of Design Sciences, University of Antwerp"
5267,University of Tabriz
5268,Sun Yat-sen University
5269,"PhD in Vehicle Engineering, Assistant Professor, Minia university"
5270,Cientifico Titular. Instituto Nacional de Investigación y Tecnología Agraria y Alimentaria
5271,Chung Yuan Christian University
5272,"Assistant Professor of Marketing, Montpellier Business School"
5273,Fundación Altiplano
5274,"PARC, a Xerox Company"
5275,"Senior Scientist, Paul Scherrer Institute"
5276,Research Institute in Civil and Mechanical Engineering (GeM - UMR CNRS 6183)
5277,Arizona State University
5278,"Professor, Université du Maine"
5279,Associate professor
5280,"PhD Candidate, University of Calgary"
5281,"School of Public Health, Texas A&M University"
5282,"Professor, Chubu University"
5283,"National Human Genome Research Institute, National Institutes of Health"
5284,Novosibirsk State Technical University
5285,"Director, Product Management and Innovation"
5286,Centro de Investigación Biomédica en Red de Enfermedades Hepáticas y Digestivas CIBERehd
5287,"Post-Doctoral Researcher, King Abdullah International Medical Research Center"
5288,Biochemistry Laboratory
5289,Cincinnati Children's Hospital
5290,Assistente do Grupo de Cirurgia do Ombro e Cotovelo da Faculdade de Medicina do ABC
5291,"Professor, Universidade Federal de Alfenas"
5292,"Professor of Linguistics, Dept. of English Lang. & Lit., Hanyang University, Seoul"
5293,"Istituto Ortopedico Rizzoli, Bologna, IT"
5294,CNRS Researcher at University of Bordeaux
5295,"Irwin Fridovich Distinguished Professor and Chair  Dept Pharmacology & Chemical Biology, University of Pittsburgh School of Medicine"
5296,"Professor of Anatomy and Cell Biology, University of Kansas Medical Center"
5297,"Professor of Computer Sciences, University of Wisconsin - Madison"
5298,Henry Ford
5299,"Associate Professor of Microbiology, NYU School of Medicine"
5300,"Profesor de Ingeniería de Sistemas y Automática, Universidad de Extremadura"
5301,shahrekord university of medical sciences
5302,The Institute of Biomedicine of Seville
5303,"Professor of Biological Sciences, Dartmouth"
5304,"Ophthalmologist, Hospital Clínic de Barcelona"
5305,Texas State University
5306,Doutora
5307,UNICAMP Saúde Coletiva Epidemiologia
5308,University of Karachi
5309,'G. d'Annunzio' University of Chieti-Pescara
5310,"University College London UCL, Professor of Public Policy"
5311,"Assistant Professor, Wayne State University"
5312,Istanbul University
5313,Emory University School of Medicine
5314,"Professor of Biochemistry, University of Nevada, Reno"
5315,IIT Kharagpur
